{"run":104,"commit":"5ed22d1","metric":7.001593,"metrics":{"one_d_ns":5.811148,"two_d_ns":8.435907,"scalar_ns":7.415331,"array_ns":5.254466,"locate1d_local_ns":3.452217,"eval2d_ebl_ns":4.312789,"max_cv_pct":4.561502},"status":"discard","description":"Moved the C row-length load between the two fused searches; retaining metadata across even one locate still worsened combined code generation.","timestamp":1789423246081,"segment":0,"confidence":7.940646588538796,"asi":{"hypothesis":"Loading fp.shape[1] between dimension-1 and dimension-0 searches may hide metadata latency without the long live range from run 83.","revisits_run":83,"changed_assumption":"The metadata value remains live across only the second search rather than both searches.","rollback_reason":"Primary regressed 0.29%; combined local/random both worsened about 0.3%, and locate2d noise moved negatively.","next_action_hint":"Keep fp.shape[1] immediately before flat offset calculation; do not retain it across either search."}}
{"run":105,"commit":"5ed22d1","metric":7.001322,"metrics":{"one_d_ns":5.844195,"two_d_ns":8.387556,"scalar_ns":7.405486,"array_ns":5.288258,"locate1d_local_ns":3.467164,"eval2d_ebl_ns":4.34315,"max_cv_pct":4.077296},"status":"discard","description":"Retried cached flat iterators only in the versioned extrapolating 1D array loop; Numba already hoisted equivalent metadata and array1d was unchanged.","timestamp":1789423352208,"segment":0,"confidence":8.302939265656324,"asi":{"hypothesis":"After loop versioning, retaining x.flat and out.flat descriptors may remove repeated property setup from the direct extrapolating loop.","revisits_run":33,"changed_assumption":"The experiment is isolated to the newer branch-free extrapolating 1D loop rather than the former shared combined array loops.","rollback_reason":"Primary regressed 0.28% and array1d was effectively identical at 3.697 ns; Numba already canonicalizes flat iterator metadata.","next_action_hint":"Keep direct x.flat[i] and out.flat[i] accesses and retain the guide's warning against cached flat iterators."}}
{"run":106,"commit":"5ed22d1","metric":6.994937,"metrics":{"one_d_ns":5.812285,"two_d_ns":8.41823,"scalar_ns":7.400293,"array_ns":5.277866,"locate1d_local_ns":3.464802,"eval2d_ebl_ns":4.339078,"max_cv_pct":4.241699},"status":"discard","description":"No-change verification with the final comments and performance guide reproduced the selected implementation near 6.99 ns.","timestamp":1789423455160,"segment":0,"confidence":8.674546452787139,"asi":{"hypothesis":"The documented final implementation should reproduce the 6.98 ns best without any source-code optimization change.","rollback_reason":"No code change exists; 6.9949 ns is 0.19% above the 6.9816 ns best and within established run noise.","next_action_hint":"Retain run 100 as the measured best and avoid speculative source churn after exhaustive optimization."}}
{"run":107,"commit":"5ed22d1","metric":7.151902,"metrics":{"one_d_ns":5.968898,"two_d_ns":8.56937,"scalar_ns":7.609694,"array_ns":5.244371,"locate1d_local_ns":3.608078,"eval2d_ebl_ns":4.324141,"max_cv_pct":4.525804},"status":"discard","description":"Tightened the upward cold-search lower bound using the already-proven next grid point; despite a valid invariant, generated search/caller performance regressed broadly.","timestamp":1789423572954,"segment":0,"confidence":9.724460394861778,"asi":{"hypothesis":"After next_upper <= x, starting cold search at next_index+1 will narrow the range and avoid considering one impossible interval.","rollback_reason":"Primary regressed 2.4%; locate1d random rose about 11%, local locate 4%, and local 2D combined about 11%, despite the mathematically tighter bound.","next_action_hint":"Keep next_index as the fallback lower bound. Binary iteration shape and inlined caller code generation outweigh the one-element range tightening.","learning":"A stronger search invariant is not automatically faster; midpoint sequence and caller register/code layout dominate this tiny kernel."}}
{"run":108,"commit":"5ed22d1","metric":6.982988,"metrics":{"one_d_ns":5.801575,"two_d_ns":8.404979,"scalar_ns":7.396559,"array_ns":5.237199,"locate1d_local_ns":3.462527,"eval2d_ebl_ns":4.347943,"max_cv_pct":4.169585},"status":"discard","description":"Reversed operand order in the cold binary comparison while preserving NaN semantics; generated performance was indistinguishable from the current form.","timestamp":1789423728303,"segment":0,"confidence":11.042201899721757,"asi":{"hypothesis":"Writing needle < haystack[mid] may generate a more favorable compare orientation in distant binary searches.","rollback_reason":"Primary was 0.019% worse; random locate and combined random 1D were unchanged/slightly slower, so the forms are equivalent within noise.","next_action_hint":"Keep haystack[mid] > needle for readability and consistency with the standalone search."}}
{"run":109,"commit":"5ed22d1","metric":7.037683,"metrics":{"one_d_ns":5.821037,"two_d_ns":8.508617,"scalar_ns":7.433719,"array_ns":5.352384,"locate1d_local_ns":3.46036,"eval2d_ebl_ns":4.307073,"max_cv_pct":4.697518},"status":"discard","description":"Removed explicit 2D array corner locals while retaining row views; losing the tested row-contiguous load schedule slowed array2d materially.","timestamp":1789423855211,"segment":0,"confidence":11.12429617088472,"asi":{"hypothesis":"Row-base caching may make four explicit corner locals unnecessary and reduce register pressure in the versioned 2D array loop.","rollback_reason":"Primary regressed 0.80% and array2d rose 4.3% from about 7.46 to 7.78 ns; direct expressions restore column-wise dependency scheduling.","next_action_hint":"Keep explicit lower0/lower1/upper0/upper1 locals and their row-contiguous load order, as documented."}}
{"run":110,"commit":"5ed22d1","metric":6.987611,"metrics":{"one_d_ns":5.781261,"two_d_ns":8.445683,"scalar_ns":7.392031,"array_ns":5.274159,"locate1d_local_ns":3.449245,"eval2d_ebl_ns":4.342762,"max_cv_pct":4.00301},"status":"discard","description":"Revisited branchless binary bound updates in the cold range helper; isolated random locate improved, but composed pipelines, arrays, and 2D callers regressed.","timestamp":1789423982866,"segment":0,"confidence":11.18574253738596,"asi":{"hypothesis":"Select-style bound updates may reduce unpredictable branches now that only distant fallbacks execute the isolated range helper.","revisits_run":32,"changed_assumption":"The branchless loop is confined to the non-inlined cold range helper rather than the former full search implementation with adjacent checks.","rollback_reason":"Primary regressed 0.086%; locate1d random improved 3.1%, but pipeline1d, combined random, arrays, and 2D callers moved backward.","next_action_hint":"Keep explicit binary branches for balanced composition; do not specialize solely for isolated random locate.","learning":"Branchless search can win in isolation but worsens instruction dependencies and caller composition enough to lose the balanced metric."}}
{"run":111,"commit":"5ed22d1","metric":6.984666,"metrics":{"one_d_ns":5.789157,"two_d_ns":8.427059,"scalar_ns":7.398813,"array_ns":5.236774,"locate1d_local_ns":3.453844,"eval2d_ebl_ns":4.351607,"max_cv_pct":4.309378},"status":"discard","description":"Inverted 1D array loop versioning so the common extrapolating loop falls through; array1d improved narrowly but the balanced primary did not.","timestamp":1789424107635,"segment":0,"confidence":11.235168871045145,"asi":{"hypothesis":"Placing the non-extrapolating loop behind the taken branch will make the common extrapolate=True loop the fall-through path.","rollback_reason":"Primary was 0.043% worse; array1d improved about 1.1%, but the effect was too narrow and unchanged 2D cases moved backward.","next_action_hint":"Keep the established extrapolating-loop-first structure; do not tune branch layout to one narrow case."}}
{"run":112,"commit":"5ed22d1","metric":7.003848,"metrics":{"one_d_ns":5.805791,"two_d_ns":8.449129,"scalar_ns":7.403096,"array_ns":5.308274,"locate1d_local_ns":3.459888,"eval2d_ebl_ns":4.36713,"max_cv_pct":4.908},"status":"discard","description":"Inverted 2D array loop versioning so extrapolation falls through; unlike 1D, the larger row-cached loop compiled worse in that position.","timestamp":1789424208819,"segment":0,"confidence":11.313585349246784,"asi":{"hypothesis":"Making the common extrapolate=True 2D array loop the fall-through path may reduce mode-branch overhead.","rollback_reason":"Primary regressed 0.32% and array2d rose 2.3% from about 7.46 to 7.63 ns; source block order affects the larger loop negatively.","next_action_hint":"Keep the extrapolating 2D loop first with its early return, as documented."}}
{"run":113,"commit":"5ed22d1","metric":7.041036,"metrics":{"one_d_ns":5.867907,"two_d_ns":8.448701,"scalar_ns":7.442073,"array_ns":5.337646,"locate1d_local_ns":3.548365,"eval2d_ebl_ns":4.340188,"max_cv_pct":4.311926},"status":"discard","description":"Loaded the hinted upper endpoint before the lower endpoint to expose both memory operations earlier; delaying the first comparison dependency hurt hot locate paths.","timestamp":1789424322829,"segment":0,"confidence":13.475907401199013,"asi":{"hypothesis":"Loading the upper endpoint first may overlap adjacent grid loads and shorten the later upper-bound comparison path.","rollback_reason":"Primary regressed 0.85%; local locate rose 2.2%, array1d 2%, and combined/random 2D also worsened.","next_action_hint":"Preserve lower-then-upper endpoint load order because the first direction comparison depends on lower."}}
{"run":114,"commit":"5ed22d1","metric":7.027951,"metrics":{"one_d_ns":5.815568,"two_d_ns":8.493081,"scalar_ns":7.40987,"array_ns":5.394104,"locate1d_local_ns":3.463731,"eval2d_ebl_ns":4.339991,"max_cv_pct":4.068616},"status":"discard","description":"Reversed the initial lower-bound comparison operands while preserving NaN behavior; 1D locate was unchanged and array2d/code layout regressed.","timestamp":1789424416017,"segment":0,"confidence":16.55030691098446,"asi":{"hypothesis":"Writing x >= lower may produce a more favorable hot direction compare than lower <= x.","rollback_reason":"Primary regressed 0.66%; locate1d was unchanged while array2d rose about 6%, showing no direct backend benefit and adverse code layout.","next_action_hint":"Keep lower <= x for consistent grid-first comparisons."}}
{"run":115,"commit":"5ed22d1","metric":7.073195,"metrics":{"one_d_ns":5.821993,"two_d_ns":8.593293,"scalar_ns":7.475467,"array_ns":5.364168,"locate1d_local_ns":3.457779,"eval2d_ebl_ns":4.361715,"max_cv_pct":4.527725},"status":"discard","description":"Added a dimension-1-first hint extraction overload for fused C interpolation; duplicated overload machinery worsened C callers and code layout.","timestamp":1789424539897,"segment":0,"confidence":20.636223964968895,"asi":{"hypothesis":"Loading hint component 1 before component 0 will align hint extraction with the successful dimension-1-first C search order and shorten ilb1 latency.","rollback_reason":"Primary regressed 1.3%; combined2d local/random rose about 4.8%/1.6%, and locate/array2d also worsened. Extra overload/code structure dominates any load ordering.","next_action_hint":"Keep the shared _initial_indices overload and let LLVM schedule tuple component loads; only reorder the actual C searches."}}
{"run":116,"commit":"5ed22d1","metric":7.099661,"metrics":{"one_d_ns":5.999138,"two_d_ns":8.402072,"scalar_ns":7.5345,"array_ns":5.274164,"locate1d_local_ns":3.870491,"eval2d_ebl_ns":4.34482,"max_cv_pct":4.028464},"status":"discard","description":"Peeled the first cold binary-search iteration to remove one loop test; LLVM's existing loop form was better and search paths regressed.","timestamp":1789424663448,"segment":0,"confidence":27.194218103311062,"asi":{"hypothesis":"Peeling one binary-search iteration inside the out-of-line cold helper may remove a loop condition without expanding callers.","rollback_reason":"Primary regressed 1.7%; locate1d local/random rose about 12%/6%, and combined 1D local also worsened.","next_action_hint":"Keep the canonical while loop; LLVM already rotates/optimizes it more effectively than source duplication."}}
{"run":117,"commit":"5ed22d1","metric":6.988475,"metrics":{"one_d_ns":5.817112,"two_d_ns":8.395709,"scalar_ns":7.388024,"array_ns":5.292404,"locate1d_local_ns":3.449404,"eval2d_ebl_ns":4.351756,"max_cv_pct":4.241127},"status":"discard","description":"Calculated the C-eval flat offset before loading weights to expose its dependency chain earlier; C evaluation was unchanged and the primary did not improve.","timestamp":1789424778052,"segment":0,"confidence":27.353796886434246,"asi":{"hypothesis":"Starting C-layout index/offset calculation before weight loads may shorten the dependent corner-address critical path.","rollback_reason":"Primary regressed 0.10%; C eval changed only from about 3.390 to 3.387 ns, far below noise, while array cases moved backward.","next_action_hint":"Keep weight loads and extrapolation rejection before index/offset work; LLVM already schedules the default extrapolating path."}}
{"run":118,"commit":"5ed22d1","metric":7.01109,"metrics":{"one_d_ns":5.841242,"two_d_ns":8.415227,"scalar_ns":7.425947,"array_ns":5.259616,"locate1d_local_ns":3.469614,"eval2d_ebl_ns":4.348302,"max_cv_pct":4.052726},"status":"discard","description":"No-change verification of the settled implementation after recent failed scheduling experiments; timings remained within normal run variation.","timestamp":1789424836446,"segment":0,"confidence":27.515259577659354,"asi":{"hypothesis":"The latest next-action hints consistently favor preserving the settled source, which should reproduce near the 6.98 ns best without speculative changes.","rollback_reason":"No source change exists; the 7.011 ns result is 0.42% above the best and consistent with established measurement variation.","next_action_hint":"Retain the run-100 best implementation; backlog ideas require new APIs and remain outside this drop-in optimization scope."}}
{"run":119,"commit":"5ed22d1","metric":7.00721,"metrics":{"one_d_ns":5.830682,"two_d_ns":8.42114,"scalar_ns":7.410715,"array_ns":5.296271,"locate1d_local_ns":3.488248,"eval2d_ebl_ns":4.336779,"max_cv_pct":4.364236},"status":"discard","description":"Moved the C row-length load between the two fused searches; retaining metadata across even one locate still worsened combined code generation.","timestamp":1789424939258,"segment":0,"confidence":27.619591467604366,"asi":{"hypothesis":"Loading fp.shape[1] between dimension-1 and dimension-0 searches may hide metadata latency without the long live range from run 83.","revisits_run":83,"changed_assumption":"The metadata value now remains live across only the second locate, rather than both locate calls.","rollback_reason":"Primary regressed 0.37%; combined local/random both worsened about 0.3%, and locate2d noise moved negatively.","next_action_hint":"Keep fp.shape[1] immediately before flat offset calculation; do not retain it across either search."}}
{"run":120,"commit":"5ed22d1","metric":6.985089,"metrics":{"one_d_ns":5.815466,"two_d_ns":8.38995,"scalar_ns":7.396071,"array_ns":5.248392,"locate1d_local_ns":3.470717,"eval2d_ebl_ns":4.305643,"max_cv_pct":4.664061},"status":"discard","description":"Set NumPy error semantics on the always-inline 1D locate helper to remove redundant zero-division handling under valid grid preconditions; hot locate timings were unchanged.","timestamp":1789425050787,"segment":0,"confidence":27.724717576802625,"asi":{"hypothesis":"Because valid grids have nonzero interval widths, error_model='numpy' on the locate helper may remove scalar division-by-zero handling without changing supported semantics.","rollback_reason":"Primary was 0.05% worse and directly affected locate timings were unchanged; the inline helper option does not improve generated callers.","next_action_hint":"Keep the standard project JIT options; do not broaden error-model changes to public overloads without a demonstrated benefit."}}
{"run":121,"commit":"5ed22d1","metric":6.983504,"metrics":{"one_d_ns":5.81789,"two_d_ns":8.382649,"scalar_ns":7.387541,"array_ns":5.271581,"locate1d_local_ns":3.463278,"eval2d_ebl_ns":4.28876,"max_cv_pct":5.344152},"status":"discard","description":"Moved the shared C-eval complement ahead of four corner loads; C evaluation improved, but the balanced primary remained slightly worse.","timestamp":1789425200042,"segment":0,"confidence":28.249002676753538,"asi":{"hypothesis":"Computing 1-weight0 before C-layout corner loads may overlap the subtraction with memory latency while preserving row-contiguous loads.","rollback_reason":"Primary was 0.027% worse despite C eval improving about 2.3%; the narrow gain did not satisfy the primary-only acceptance rule.","next_action_hint":"A verification rerun could determine whether the C-eval gain is reproducible, but retain the original ordering unless the balanced primary improves.","learning":"Moving only the complement, without disturbing contiguous corner loads, may reduce C-layout eval latency; this is the strongest isolated signal among recent source-order experiments."}}
