{"run":81,"commit":"3772ae0","metric":6.996449,"metrics":{"one_d_ns":5.823126,"two_d_ns":8.406188,"scalar_ns":7.411009,"array_ns":5.246617,"locate1d_local_ns":3.485352,"eval2d_ebl_ns":4.341231,"max_cv_pct":4.487409},"status":"keep","description":"Added a scalar-only always-inline public 1D interpolation overload while leaving arrays out of line; combined scalar calls improve 9-16%.","timestamp":1789421232246,"segment":0,"confidence":8.148216279992202,"asi":{"hypothesis":"After the branch-local locate rewrite, a mutually exclusive scalar-only public overload can remove combined-call overhead without expanding array code.","revisits_run":21,"changed_assumption":"Run 21 forced one shared overload policy before early-return locate and also exposed the array path; the new template inlines only scalar signatures and leaves arrays on the normal overload.","interp1d_local_gain_pct":16.28,"interp1d_random_gain_pct":9.35,"primary_gain_pct":2.24,"learning":"Public combined 1D inlining becomes strongly profitable when isolated from array signatures and paired with SSA-friendly locate code."}}
{"run":82,"commit":"3772ae0","metric":7.014468,"metrics":{"one_d_ns":5.856742,"two_d_ns":8.401046,"scalar_ns":7.420771,"array_ns":5.293261,"locate1d_local_ns":3.464369,"eval2d_ebl_ns":4.349713,"max_cv_pct":4.35975},"status":"discard","description":"Retried scalar-only public 1D eval inlining after the locate rewrite; repeated-field pipeline performance again regressed.","timestamp":1789421333015,"segment":0,"confidence":7.911739898525121,"asi":{"hypothesis":"SSA-friendly locate and scalar-only overload isolation may now make public eval inlining profitable in locate-plus-four-field callers.","revisits_run":18,"changed_assumption":"The caller's locate body and overload organization changed substantially, and array eval signatures remain on a normal overload.","rollback_reason":"Primary regressed 0.26% and pipeline1d rose 3.3% from 5.15 to 5.32 ns, confirming that the eval call boundary still aids scheduling/code size.","next_action_hint":"Keep public 1D eval out of line even though public combined 1D interpolation is now inline."}}
{"run":83,"commit":"3772ae0","metric":7.031212,"metrics":{"one_d_ns":5.874414,"two_d_ns":8.415808,"scalar_ns":7.444854,"array_ns":5.283239,"locate1d_local_ns":3.460513,"eval2d_ebl_ns":4.346972,"max_cv_pct":4.130948},"status":"discard","description":"Loaded the C-layout row length before both searches in fused 2D interpolation; longer live range outweighed any latency overlap.","timestamp":1789421403366,"segment":0,"confidence":6.4679801788406435,"asi":{"hypothesis":"Loading fp.shape[1] before searches may overlap metadata access and shorten the post-search flat-address critical path.","rollback_reason":"Primary regressed 0.50%; local combined2d improved only 1.2% while random combined2d worsened about 1%, and unrelated code layout degraded.","next_action_hint":"Load n1 immediately before flat offset calculation to avoid retaining it across both searches."}}
{"run":84,"commit":"3772ae0","metric":6.990056,"metrics":{"one_d_ns":5.81319,"two_d_ns":8.405175,"scalar_ns":7.403791,"array_ns":5.2434,"locate1d_local_ns":3.448397,"eval2d_ebl_ns":4.345697,"max_cv_pct":4.345758},"status":"discard","description":"Cached the upper-row flat offset in C scalar evaluation; LLVM already folded repeated address additions and C eval worsened.","timestamp":1789421513976,"segment":0,"confidence":6.188245435852557,"asi":{"hypothesis":"Reusing offset+n1 for two upper-row corner loads will reduce integer address arithmetic in C evaluation.","rollback_reason":"The 0.09% primary gain is below noise and C eval rose from roughly 3.34-3.38 to 3.40 ns; the apparent gain came from unrelated cases.","next_action_hint":"Keep direct flat offset expressions; backend addressing already shares the row displacement."}}
{"run":85,"commit":"3772ae0","metric":7.000111,"metrics":{"one_d_ns":5.829537,"two_d_ns":8.405737,"scalar_ns":7.403362,"array_ns":5.29035,"locate1d_local_ns":3.461668,"eval2d_ebl_ns":4.349562,"max_cv_pct":5.423744},"status":"discard","description":"Retried explicit complement reuse in the C fused scalar helper after locate restructuring; direct gains remained too small to improve the balanced primary.","timestamp":1789421569201,"segment":0,"confidence":6.039617241501384,"asi":{"hypothesis":"Branch-local locate and scalar-only public inlining may now make one shared 1-weight0 value profitable in fused C interpolation.","revisits_run":46,"changed_assumption":"The surrounding locate SSA and public overload code changed substantially since the first test.","rollback_reason":"Primary regressed 0.05%; combined local/random improved only 0.7%/0.6%, again too narrow and small to offset register/code-layout effects.","next_action_hint":"Retain direct complement expressions in fused C interpolation; two runs show no balanced benefit."}}
{"run":86,"commit":"3772ae0","metric":7.648226,"metrics":{"one_d_ns":6.604162,"two_d_ns":8.857346,"scalar_ns":7.99822,"array_ns":6.115015,"locate1d_local_ns":4.230573,"eval2d_ebl_ns":4.31667,"max_cv_pct":4.698006},"status":"discard","description":"Added an array-only always-inline public 1D overload to remove one wrapper boundary; code expansion destabilized the compiled suite and broadly regressed performance.","timestamp":1789421693992,"segment":0,"confidence":5.897961046733982,"asi":{"hypothesis":"Inlining only the allocation/output wrapper while retaining the array loop implementation call will remove one array call boundary safely.","changed_assumption":"The scalar overload is now separate and array loops are versioned, unlike the shared public inlining tested in run 21.","rollback_reason":"Primary regressed 9.3%; array1d rose 18%, array2d 15%, and many scalar/search paths also slowed. Extra array overload inlining causes severe code-layout/compiler effects.","next_action_hint":"Keep all public array overloads at default inline policy; do not apply the analogous change to 2D."}}
{"run":87,"commit":"3772ae0","metric":6.973949,"metrics":{"one_d_ns":5.810859,"two_d_ns":8.36984,"scalar_ns":7.382601,"array_ns":5.245967,"locate1d_local_ns":3.463882,"eval2d_ebl_ns":4.312313,"max_cv_pct":4.400272},"status":"discard","description":"Retried complement caching in the row-view 2D array loop; the target case was unchanged, so the apparent primary gain came from unrelated noise.","timestamp":1789421756080,"segment":0,"confidence":5.818877491201254,"asi":{"hypothesis":"Row-view address caching may free enough registers for explicit 1-weight0 reuse to benefit the 2D array loop.","revisits_run":67,"changed_assumption":"Corner addressing now keeps only two row bases rather than four multidimensional address expressions.","rollback_reason":"array2d changed only from 7.487 to 7.473 ns, far below noise; the 0.32% aggregate gain came from untouched scalar cases and does not justify the extra local.","next_action_hint":"Keep direct complement expressions in array2d and rely on LLVM CSE."}}
{"run":88,"commit":"3772ae0","metric":7.010591,"metrics":{"one_d_ns":5.821983,"two_d_ns":8.441863,"scalar_ns":7.432928,"array_ns":5.232728,"locate1d_local_ns":3.475068,"eval2d_ebl_ns":4.414633,"max_cv_pct":4.369961},"status":"discard","description":"Shortened the upper-row view live range by loading the lower row first; serializing row setup hurt strided evaluation.","timestamp":1789421809013,"segment":0,"confidence":5.741886678544606,"asi":{"hypothesis":"Loading both lower-row corners before creating the upper-row view will reduce live descriptors and register pressure.","rollback_reason":"Primary regressed 0.20% and strided eval rose about 3% to 5.75 ns; constructing both row bases first exposes more memory-level parallelism.","next_action_hint":"Preserve lower-row/upper-row setup before all four corner loads, and document the ordering."}}
{"run":89,"commit":"3772ae0","metric":6.996762,"metrics":{"one_d_ns":5.811233,"two_d_ns":8.424145,"scalar_ns":7.404806,"array_ns":5.27004,"locate1d_local_ns":3.467355,"eval2d_ebl_ns":4.36221,"max_cv_pct":3.786143},"status":"discard","description":"Moved generic 2D complement calculation ahead of corner loads to overlap arithmetic; compiler scheduling and eval performance were unchanged.","timestamp":1789421863231,"segment":0,"confidence":5.737306642593435,"asi":{"hypothesis":"Computing 1-weight0 before dependent row loads will hide its latency behind corner memory accesses.","rollback_reason":"Primary was unchanged/slightly worse and strided eval stayed at 5.58 ns; LLVM already schedules the independent subtraction appropriately.","next_action_hint":"Keep complement calculation adjacent to bilinear arithmetic for clearer source."}}
{"run":90,"commit":"3772ae0","metric":7.03833,"metrics":{"one_d_ns":5.81707,"two_d_ns":8.515988,"scalar_ns":7.439718,"array_ns":5.333786,"locate1d_local_ns":3.467118,"eval2d_ebl_ns":4.340841,"max_cv_pct":3.717358},"status":"discard","description":"Reversed hot upper-bound comparison operands without changing semantics; generated performance did not improve and 2D paths regressed.","timestamp":1789421937191,"segment":0,"confidence":5.729662404014232,"asi":{"hypothesis":"Writing x < upper may produce a more favorable compare/branch form than upper > x in hot same/adjacent paths.","rollback_reason":"Primary regressed 0.60%; 1D locate was unchanged and 2D locate/array worsened, so operand spelling provides no backend gain.","next_action_hint":"Keep upper > x, which reads naturally as the bracketing condition."}}
{"run":91,"commit":"3772ae0","metric":7.079902,"metrics":{"one_d_ns":5.823726,"two_d_ns":8.607034,"scalar_ns":7.443802,"array_ns":5.510478,"locate1d_local_ns":3.44865,"eval2d_ebl_ns":4.353051,"max_cv_pct":4.146671},"status":"discard","description":"No-change verification of run 81/72 best; most scalar results reproduced, while array2d showed a transient slowdown and raised the aggregate.","timestamp":1789421975703,"segment":0,"confidence":5.7308382714947825,"asi":{"hypothesis":"The current best source will reproduce near 7.00 ns without code changes.","rollback_reason":"The rerun measured 7.08 ns due mainly to array2d at 8.30 versus 7.49 ns; no source change exists to keep, and stable scalar cases stayed close.","next_action_hint":"Treat array2d as the largest remaining run-level noise source; use the best kept source and additional end-of-run verification rather than reacting to one transient."}}
{"run":92,"commit":"3772ae0","metric":7.016254,"metrics":{"one_d_ns":5.839559,"two_d_ns":8.430058,"scalar_ns":7.422578,"array_ns":5.294902,"locate1d_local_ns":3.466923,"eval2d_ebl_ns":4.369931,"max_cv_pct":4.19103},"status":"discard","description":"Cached ilb1+1 for the two upper-column row-view loads in array2d; backend addressing already folds the increment and no target gain resulted.","timestamp":1789422030889,"segment":0,"confidence":5.732014621708188,"asi":{"hypothesis":"A shared next-column index will remove duplicate integer increments in row-view corner loads.","revisits_run":38,"changed_assumption":"The target is now the versioned row-view array loop rather than scalar multidimensional indexing.","rollback_reason":"Primary regressed 0.28% and array2d was unchanged/slightly worse at 7.51 ns; the increment is already folded into addressing modes.","next_action_hint":"Keep ilb1+1 directly in each row subscript."}}
{"run":93,"commit":"3772ae0","metric":6.991964,"metrics":{"one_d_ns":5.81038,"two_d_ns":8.413833,"scalar_ns":7.401746,"array_ns":5.259256,"locate1d_local_ns":3.477718,"eval2d_ebl_ns":4.350893,"max_cv_pct":3.976677},"status":"discard","description":"Reversed cold binary-loop comparison orientation; results were indistinguishable from the existing condition and the tiny primary movement was noise.","timestamp":1789422085163,"segment":0,"confidence":5.701727061827743,"asi":{"hypothesis":"Writing lower-plus-one less-than upper may produce a more favorable loop branch orientation.","rollback_reason":"Primary improved only 0.064%; random locate was unchanged and no directly affected case showed a meaningful gain.","next_action_hint":"Keep the established upper-greater-than-lower-plus-one spelling."}}
{"run":94,"commit":"3772ae0","metric":7.043313,"metrics":{"one_d_ns":5.855078,"two_d_ns":8.472689,"scalar_ns":7.46937,"array_ns":5.251,"locate1d_local_ns":3.580469,"eval2d_ebl_ns":4.342352,"max_cv_pct":4.774927},"status":"discard","description":"Used xp.size for 1D grid bounds instead of shape[0]; Numba's size access generated worse hot-path code.","timestamp":1789422152291,"segment":0,"confidence":5.642068596314813,"asi":{"hypothesis":"For one-dimensional grids, xp.size may provide a cheaper scalar bound than indexing shape[0].","rollback_reason":"Primary regressed 0.67% and local locate rose 3.3% from about 3.46 to 3.58 ns; shape[0] is the better Numba metadata path.","next_action_hint":"Preserve xp.shape[0] in all hot locate bounds."}}
{"run":95,"commit":"3772ae0","metric":7.046779,"metrics":{"one_d_ns":5.747392,"two_d_ns":8.639934,"scalar_ns":7.471643,"array_ns":5.258516,"locate1d_local_ns":3.441314,"eval2d_ebl_ns":4.318465,"max_cv_pct":4.830062},"status":"discard","description":"Expressed final-interval checks as index+2 == shape; 1D random improved but 2D callers suffered severe code-generation regressions.","timestamp":1789422200851,"segment":0,"confidence":5.277041201370954,"asi":{"hypothesis":"Comparing index+2 with grid length may avoid subtracting two from shape metadata on upward paths.","rollback_reason":"Primary regressed 0.72%; locate2d rose 5.7% and interp2d local 11%, despite a strong but isolated interp1d-random gain.","next_action_hint":"Keep index == shape[0]-2; its inlined code composes much better in 2D callers."}}
{"run":96,"commit":"3772ae0","metric":7.038669,"metrics":{"one_d_ns":5.912089,"two_d_ns":8.379925,"scalar_ns":7.454006,"array_ns":5.284387,"locate1d_local_ns":3.588894,"eval2d_ebl_ns":4.320839,"max_cv_pct":4.736534},"status":"discard","description":"Second no-change verification of the current best source; 2D and array timings reproduced while 1D locate/pipeline showed transient slowdown.","timestamp":1789422238029,"segment":0,"confidence":4.968872204471391,"asi":{"hypothesis":"The run-81 source should remain near its 7.00 ns best across verification measurements.","rollback_reason":"No source change exists; this run measured 7.04 ns due 1D locate/pipeline variation, while most cases remained close.","next_action_hint":"Retain run 81 as best; perform one final no-change measurement at run 100 after documentation/comments are prepared."}}
{"run":97,"commit":"3772ae0","metric":7.036231,"metrics":{"one_d_ns":5.825269,"two_d_ns":8.498929,"scalar_ns":7.462104,"array_ns":5.24486,"locate1d_local_ns":3.4583,"eval2d_ebl_ns":4.532151,"max_cv_pct":4.128855},"status":"discard","description":"Created the upper row view before the lower row in generic 2D evaluation; strided access regressed sharply.","timestamp":1789422289137,"segment":0,"confidence":4.970220279798268,"asi":{"hypothesis":"Preparing the upper row base first may overlap its index increment with lower-row setup.","rollback_reason":"Primary regressed 0.57% and strided eval rose about 8.6% to 6.06 ns; lower-row-first descriptor creation is essential for current scheduling.","next_action_hint":"Document exact lower-row then upper-row setup and contiguous lower/upper corner load order."}}
{"run":98,"commit":"3772ae0","metric":7.010002,"metrics":{"one_d_ns":5.811273,"two_d_ns":8.456002,"scalar_ns":7.427841,"array_ns":5.248028,"locate1d_local_ns":3.465482,"eval2d_ebl_ns":4.345537,"max_cv_pct":4.330456},"status":"discard","description":"Stored 2D locate weights before indices to shorten floating-value live ranges; buffered locate slowed substantially.","timestamp":1789422347352,"segment":0,"confidence":4.971569086800342,"asi":{"hypothesis":"Writing weight results first will release floating registers before integer output stores in 2D locate.","rollback_reason":"Primary regressed 0.19% and locate2d rose 4.5% from about 13.7 to 14.34 ns; contiguous index stores first schedule better.","next_action_hint":"Preserve index_out[0:2] stores before weight_out[0:2], and document the ordering."}}
{"run":99,"commit":"3772ae0","metric":7.001879,"metrics":{"one_d_ns":5.828015,"two_d_ns":8.412179,"scalar_ns":7.411719,"array_ns":5.268569,"locate1d_local_ns":3.469712,"eval2d_ebl_ns":4.347759,"max_cv_pct":4.099204},"status":"discard","description":"Pre-final no-change verification reproduced the current source at 7.00 ns with stable workload timings.","timestamp":1789422383915,"segment":0,"confidence":5.005929275537205,"asi":{"hypothesis":"The selected run-81 source will reproduce its approximately 7.00 ns aggregate before the final run.","rollback_reason":"No source change exists; 7.0019 ns is 0.08% above the kept 6.9964 ns best and confirms it within noise.","next_action_hint":"Use run 100 as the final no-change measurement, then stop experiments and add documentation/comments."}}
{"run":100,"commit":"5ed22d1","metric":6.981633,"metrics":{"one_d_ns":5.81178,"two_d_ns":8.386965,"scalar_ns":7.391116,"array_ns":5.250394,"locate1d_local_ns":3.471225,"eval2d_ebl_ns":4.344308,"max_cv_pct":4.387174},"status":"keep","description":"Final no-change verification at the 100-run limit reproduced the selected source and set the best measured aggregate at 6.98 ns.","timestamp":1789422422057,"segment":0,"confidence":4.981599751771612,"asi":{"hypothesis":"The selected source will reproduce near 7.00 ns in the final run and provide the settled measurement.","verification_of_run":81,"termination":"Reached the user-requested total of 100 experiments; no further run_experiment calls will be made.","learning":"Final stable timings confirm the run-81 source plus earlier kept array/eval improvements. The no-change measurement improved the recorded best by 0.21% to 6.9816 ns."}}
{"run":101,"commit":"5ed22d1","metric":7.130002,"metrics":{"one_d_ns":6.025541,"two_d_ns":8.436907,"scalar_ns":7.531579,"array_ns":5.421354,"locate1d_local_ns":3.754954,"eval2d_ebl_ns":4.348236,"max_cv_pct":4.181483},"status":"discard","description":"Retried explicit C fused corner locals after the branch-local locate rewrite; added live values still hurt combined interpolation and broader code layout.","timestamp":1789422920176,"segment":0,"confidence":6.220692911997017,"asi":{"hypothesis":"With branch-local locate lifetimes, explicit contiguous-row corner loads may now improve the C-layout fused scalar kernel.","revisits_run":51,"changed_assumption":"The two inlined locate calls now use early returns and substantially shorter branch-local endpoint lifetimes than in run 51.","rollback_reason":"Primary regressed 2.1%; combined local/random worsened about 0.6-0.7%, and 1D/array code layout also degraded.","next_action_hint":"Keep direct flat expressions in _interp2d_scalar_c and retain the performance comment warning against corner locals."}}
{"run":102,"commit":"5ed22d1","metric":6.993725,"metrics":{"one_d_ns":5.80997,"two_d_ns":8.418664,"scalar_ns":7.409073,"array_ns":5.241211,"locate1d_local_ns":3.457076,"eval2d_ebl_ns":4.342809,"max_cv_pct":4.182642},"status":"discard","description":"Cached fp.flat in the fused C scalar kernel while retaining direct corner expressions; Numba already canonicalized flat metadata and combined paths slowed.","timestamp":1789423037005,"segment":0,"confidence":7.894935950204358,"asi":{"hypothesis":"The large fully inlined fused C caller may benefit from naming one flat iterator descriptor even though eval-only did not.","revisits_run":47,"changed_assumption":"The target is fused C interpolation with two branch-local searches rather than the compact evaluation-only helper.","rollback_reason":"Primary regressed 0.17%; combined local/random worsened about 0.6%/1.1%, confirming direct fp.flat expressions compile better.","next_action_hint":"Keep direct fp.flat subscripts and restore the performance comment warning against descriptor/corner temporaries."}}
{"run":103,"commit":"5ed22d1","metric":6.993019,"metrics":{"one_d_ns":5.810403,"two_d_ns":8.416337,"scalar_ns":7.398069,"array_ns":5.277111,"locate1d_local_ns":3.473472,"eval2d_ebl_ns":4.351394,"max_cv_pct":4.2164},"status":"discard","description":"Retried a branch-free supplied-buffer 2D locate overload after SSA restructuring; Numba already folded allocation branches and locate did not improve.","timestamp":1789423125976,"segment":0,"confidence":7.917725295718519,"asi":{"hypothesis":"With the larger branch-local locate body, directly calling the required-buffer implementation may now remove meaningful scalar wrapper overhead.","revisits_run":56,"changed_assumption":"The nested 1D locate implementation and public scalar overload structure changed substantially since the original supplied-buffer specialization.","rollback_reason":"Primary regressed 0.16% and locate2d was unchanged/slightly worse at 13.76 ns; optional allocation branches are still eliminated automatically.","next_action_hint":"Keep the shared 2D locate wrapper and its concise performance comment."}}
