{"run":39,"commit":"5933534","metric":10.477004,"metrics":{"one_d_ns":8.157508,"two_d_ns":13.456022,"scalar_ns":10.733669,"array_ns":9.282856,"locate1d_local_ns":5.657075,"eval2d_ebl_ns":6.176852,"max_cv_pct":3.403022},"status":"discard","description":"Cached 1D function endpoints while preserving weighted-sum arithmetic; directly affected 1D paths did not improve, so the tiny aggregate change was unrelated noise.","timestamp":1789417963176,"segment":0,"confidence":16.98535546914748,"asi":{"hypothesis":"Explicit lower/upper fp locals may improve 1D evaluation address generation as corner locals did for 2D eval.","rollback_reason":"Direct 1D pipeline rose from 6.63 to 6.68 ns and array1d from 6.09 to 6.22 ns; apparent 0.09% primary gain came from unchanged 2D variation.","next_action_hint":"Keep direct fp subscripts in the 1D weighted sum. The 2D corner-local result does not transfer to two-load interpolation.","learning":"Explicit value loads only help when several 2D addressing expressions can be simplified; two 1D loads are already optimal."}}
{"run":40,"commit":"5933534","metric":10.560896,"metrics":{"one_d_ns":8.146935,"two_d_ns":13.690121,"scalar_ns":10.787864,"array_ns":9.495705,"locate1d_local_ns":5.625384,"eval2d_ebl_ns":6.179742,"max_cv_pct":2.342432},"status":"discard","description":"Manually split fused 2D locate into two searches followed by two weight calculations to expose independent divisions; combined paths became slower.","timestamp":1789418061840,"segment":0,"confidence":22.776779882930587,"asi":{"hypothesis":"Performing both 2D searches before endpoint loads and weight divisions will expose division-level parallelism hidden by two sequential locate helper calls.","rollback_reason":"Primary regressed about 0.71%; combined local/random rose from 21.20/23.87 to 22.10/24.60 ns. Extra live search results/endpoints outweighed any division overlap.","next_action_hint":"Keep sequential calls to the optimized 1D locate helper. Do not duplicate its logic in fused 2D code.","learning":"The backend schedules compact inlined locate calls better than a manually widened two-dimension dataflow."}}
{"run":41,"commit":"5933534","metric":10.490165,"metrics":{"one_d_ns":8.1806,"two_d_ns":13.45177,"scalar_ns":10.702458,"array_ns":9.490216,"locate1d_local_ns":5.623883,"eval2d_ebl_ns":6.184022,"max_cv_pct":2.963909},"status":"discard","description":"Cached the final valid lower-bound index in bsearch; compiler register allocation shifted but the aggregate did not improve consistently.","timestamp":1789418134802,"segment":0,"confidence":24.616950343328327,"asi":{"hypothesis":"Naming n-2 once will reduce repeated integer arithmetic in adjacent upward search checks.","rollback_reason":"Primary regressed slightly; 1D locate was unchanged, combined random paths worsened, and the isolated 2D locate drop was inconsistent with the identical pair of 1D searches and likely code-layout noise.","next_action_hint":"Let LLVM common-subexpression elimination handle n-2. Avoid tuning source temporaries to one composite caller's register allocation.","learning":"A trivial integer local can redistribute tiny-kernel timings but has no robust broad benefit."}}
{"run":42,"commit":"8e01fd9","metric":9.96107,"metrics":{"one_d_ns":8.106092,"two_d_ns":12.240536,"scalar_ns":10.084514,"array_ns":9.366149,"locate1d_local_ns":5.630484,"eval2d_ebl_ns":4.435525,"max_cv_pct":4.207381},"status":"keep","description":"Added a C-layout 2D scalar evaluator using one flattened base offset and adjacent corner loads; contiguous repeated-field evaluation nearly halves while strided specialization remains intact.","timestamp":1789418220644,"segment":0,"confidence":28.187782845519045,"asi":{"hypothesis":"For compile-time C-contiguous fp, one flat row-major offset will avoid four generic multidimensional address calculations in repeated 2D evaluation.","contiguous_eval_gain_pct":48.59,"strided_eval_change_pct":0.73,"learning":"Layout-specific address generation is the largest remaining 2D eval opportunity. C-layout evaluation drops from about 6.63 to 3.41 ns; A-layout retains its dedicated always-inline path around 5.78 ns.","correctness_guard":"The specialized helper is selected only when Numba reports fp.layout == 'C'; F and arbitrary-strided arrays retain generic indexing."}}
{"run":43,"commit":"12cea16","metric":9.851159,"metrics":{"one_d_ns":8.105488,"two_d_ns":11.972793,"scalar_ns":9.952496,"array_ns":9.35974,"locate1d_local_ns":5.628476,"eval2d_ebl_ns":4.425713,"max_cv_pct":4.604402},"status":"keep","description":"Added a C-layout fused 2D scalar kernel using flat row-major offsets; combined local and random interpolation improve while preserving generic-layout behavior.","timestamp":1789418297220,"segment":0,"confidence":27.432043747820654,"asi":{"hypothesis":"The flat-offset C-layout optimization from eval-only should reduce the bilinear portion of fused 2D interpolation when selected at overload time.","combined_local_gain_pct":4.34,"combined_random_gain_pct":3.12,"learning":"Compile-time C-layout specialization generalizes to fused scalar interpolation when implemented in its own low-register-pressure kernel. Generic F/A layouts remain on the original implementation."}}
{"run":44,"commit":"12cea16","metric":10.406319,"metrics":{"one_d_ns":8.331634,"two_d_ns":12.997627,"scalar_ns":10.676284,"array_ns":9.155501,"locate1d_local_ns":6.02384,"eval2d_ebl_ns":4.421455,"max_cv_pct":5.03957},"status":"discard","description":"Added a C-layout 2D array kernel with flat offsets; the target array case improved, but widespread unrelated scalar regressions made this run unreliable and the aggregate much worse.","timestamp":1789418375675,"segment":0,"confidence":27.914493019520474,"asi":{"hypothesis":"A dedicated C-layout array loop using flat row-major offsets will transfer scalar C specialization gains to each array element.","rollback_reason":"Despite array2d improving about 6.2%, primary regressed 5.6% and untouched cases simultaneously regressed: locate2d 41%, combined 11-12%, and several 1D cases 5-7%. Max CV reached 5%, indicating an anomalous run or code-layout effect.","next_action_hint":"Re-run the same isolated C-array specialization once to distinguish its strong direct-case gain from system/code-layout noise. Keep only if scalar cases return to normal and aggregate improves.","direct_signal":"array2d_local fell from 14.55 to 13.64 ns."}}
{"run":45,"commit":"12cea16","metric":9.873116,"metrics":{"one_d_ns":8.124973,"two_d_ns":11.997383,"scalar_ns":9.929188,"array_ns":9.597472,"locate1d_local_ns":5.728642,"eval2d_ebl_ns":4.385722,"max_cv_pct":4.911944},"status":"discard","description":"Verification rerun of the C-layout 2D array specialization; unaffected scalar cases normalized, but the target array case no longer improved and the aggregate remained worse.","timestamp":1789418438033,"segment":0,"confidence":25.64631367366828,"asi":{"hypothesis":"The strong direct array gain in run 44 will reproduce once the anomalous broad scalar slowdown clears.","revisits_run":44,"changed_assumption":"Run 44's unrelated 1D/2D scalar regressions and high CV suggested system noise, so the identical specialization was rerun.","rollback_reason":"array2d_local measured 14.87 ns versus 14.55 ns before the change, disproving the apparent 13.64 ns gain from run 44; primary regressed about 0.22%.","next_action_hint":"Abandon flat-offset specialization for the fused array loop. Generic multidimensional indexing is already optimal there; scalar C specialization remains valuable.","learning":"The confirmation run prevented keeping a noise-driven array optimization."}}
{"run":46,"commit":"12cea16","metric":9.861289,"metrics":{"one_d_ns":8.057496,"two_d_ns":12.068889,"scalar_ns":9.947081,"array_ns":9.443306,"locate1d_local_ns":5.629814,"eval2d_ebl_ns":4.543776,"max_cv_pct":4.285901},"status":"discard","description":"Cached the repeated lower-row complement in the C-layout fused scalar kernel; combined timings changed negligibly and the aggregate worsened.","timestamp":1789418482681,"segment":0,"confidence":22.550560698006088,"asi":{"hypothesis":"Explicitly reusing 1-weight0 will further reduce arithmetic in the C-layout fused 2D helper.","rollback_reason":"Primary regressed about 0.1%; directly affected combined local/random improved only 0.4%/0.2%, below noise, while code complexity increased.","next_action_hint":"Keep the C fused helper's direct weighted expressions; LLVM already common-subexpressions the complement sufficiently.","learning":"The major C-layout gain comes from flat addressing, not source-level complement reuse."}}
{"run":47,"commit":"12cea16","metric":9.895954,"metrics":{"one_d_ns":8.148933,"two_d_ns":12.017514,"scalar_ns":9.975538,"array_ns":9.507459,"locate1d_local_ns":5.646449,"eval2d_ebl_ns":4.430334,"max_cv_pct":4.614003},"status":"discard","description":"Cached fp.flat in the C-layout scalar evaluator; Numba already hoists flat-array metadata and no meaningful eval gain resulted.","timestamp":1789418514486,"segment":0,"confidence":15.015091704682968,"asi":{"hypothesis":"Reusing one flat iterator descriptor will reduce repeated metadata construction around four C-layout corner loads.","rollback_reason":"Primary regressed about 0.45%; C eval changed only from 3.406 to 3.398 ns, far below noise, and no other path is directly affected.","next_action_hint":"Keep direct fp.flat subscripts in tiny C helpers. Numba already canonicalizes the descriptor accesses.","learning":"As in run 33, explicit flat iterator caching is not useful even in the specialized scalar helper."}}
{"run":48,"commit":"701dcdc","metric":9.581074,"metrics":{"one_d_ns":8.185062,"two_d_ns":11.215184,"scalar_ns":9.637938,"array_ns":9.301747,"locate1d_local_ns":5.631388,"eval2d_ebl_ns":4.432092,"max_cv_pct":12.057357},"status":"keep","description":"Split C-layout fused scalar interpolation into its own always-inline public overload; scalarized hints and flat values reduce combined 2D calls to 17-19 ns.","timestamp":1789418582671,"segment":0,"confidence":13.261588060347497,"asi":{"hypothesis":"A mutually exclusive always-inline C-layout combined overload can eliminate caller-side view/call overhead without expanding generic or array implementations.","combined_local_gain_pct":14.32,"combined_random_gain_pct":17.29,"learning":"Unlike globally inlining combined interpolation in run 21, layout-specific template inlining is a major win. Restricting it to scalar C fp controls code size and exposes both flat addressing and hint-row scalarization.","noise_note":"Maximum per-case CV was 12%, but directly affected combined gains are 14-17% and the primary improves 2.7%, so the result exceeds noise substantially."}}
{"run":49,"commit":"7b9ccb5","metric":9.527847,"metrics":{"one_d_ns":8.105132,"two_d_ns":11.200295,"scalar_ns":9.568058,"array_ns":9.329315,"locate1d_local_ns":5.63032,"eval2d_ebl_ns":4.380652,"max_cv_pct":5.073012},"status":"keep","description":"Verification rerun of the C-layout combined overload; the 17-19 ns scalar timings reproduced and benchmark dispersion returned to normal.","timestamp":1789418611101,"segment":0,"confidence":12.969488212567313,"asi":{"hypothesis":"Run 48's large C-layout combined gains will reproduce despite its high maximum sample CV.","verification_of_run":48,"learning":"The result is confirmed: interp2d local/random remain 17.34/18.98 ns, and max CV fell from 12.1% to 5.1%. No code changes were needed."}}
{"run":50,"commit":"7b9ccb5","metric":9.884801,"metrics":{"one_d_ns":8.140481,"two_d_ns":12.002888,"scalar_ns":9.995856,"array_ns":9.347757,"locate1d_local_ns":5.65492,"eval2d_ebl_ns":5.379682,"max_cv_pct":2.731572},"status":"discard","description":"Extended always-inline 2D eval overload to C-layout flat evaluator; both C and strided repeated-field paths slowed substantially.","timestamp":1789418691083,"segment":0,"confidence":12.613381317468292,"asi":{"hypothesis":"The smaller flat-offset C evaluator may now benefit from outer public-overload inlining and caller-side index/weight view scalarization.","rollback_reason":"Primary regressed about 3.7%; C eval rose from 3.34 to 4.85 ns and strided eval from 5.75 to 5.96 ns. Combined paths remained fast but eval code pressure became severe.","next_action_hint":"Keep C eval's public overload out of line and A-layout eval inline only. Flat addressing already delivers the C gain inside the compact callee.","learning":"Caller-side scalarization cannot compensate for duplicated flat-eval code in the repeated-field loop; the normal C overload boundary is essential."}}
{"run":51,"commit":"7b9ccb5","metric":9.576546,"metrics":{"one_d_ns":8.125875,"two_d_ns":11.286199,"scalar_ns":9.64523,"array_ns":9.240392,"locate1d_local_ns":5.625713,"eval2d_ebl_ns":4.434543,"max_cv_pct":4.197676},"status":"discard","description":"Added explicit corner/complement locals to the C-layout fused scalar helper; extra live values again hurt combined interpolation.","timestamp":1789418741674,"segment":0,"confidence":12.6708720776523,"asi":{"hypothesis":"The C-layout flat helper may gain from the same explicit corner loads that optimized eval-only.","rollback_reason":"Primary regressed about 0.51%; directly affected combined local/random rose from 17.34/18.98 to 17.48/19.55 ns.","next_action_hint":"Keep direct flat expressions in the fused C helper. Its surrounding searches make corner temporaries costly, consistent with run 24.","learning":"Eval-only and fused kernels require distinct expression forms even after C-layout specialization."}}
{"run":52,"commit":"65428a0","metric":8.376824,"metrics":{"one_d_ns":7.546392,"two_d_ns":9.298639,"scalar_ns":8.769506,"array_ns":6.661937,"locate1d_local_ns":4.422757,"eval2d_ebl_ns":4.432586,"max_cv_pct":4.976217},"status":"keep","description":"Fused same/adjacent search and endpoint reuse into the inline 1D locate helper; local, fused, and array workloads improve dramatically, though distant random searches now duplicate fallback checks.","timestamp":1789418838743,"segment":0,"confidence":14.475753822991974,"asi":{"hypothesis":"Keeping fast-path grid endpoints live through weight calculation will eliminate the bsearch call and endpoint reloads for same/adjacent intervals.","local_locate_gain_pct":21.46,"pipeline_gain_pct":17.86,"array_1d_gain_pct":22.92,"locate_2d_gain_pct":37.83,"combined_2d_local_gain_pct":37.43,"random_regression":"locate1d random +19%, interp1d random +23%, interp2d random +24% because distant fallback re-enters bsearch_impl and repeats local checks.","learning":"Endpoint reuse is a major locality optimization and matches the EBL hint-reuse pattern. Next priority is a cold range-search helper that avoids duplicate checks on distant fallbacks without inlining the binary loop."}}
{"run":53,"commit":"3fed49c","metric":7.967495,"metrics":{"one_d_ns":6.994199,"two_d_ns":9.076234,"scalar_ns":8.314776,"array_ns":6.436922,"locate1d_local_ns":4.44961,"eval2d_ebl_ns":4.428154,"max_cv_pct":4.652416},"status":"keep","description":"Added a cold range-search helper and routed distant fused-locate fallbacks directly to known bounds; local endpoint reuse remains while random-query duplication is largely removed.","timestamp":1789418928869,"segment":0,"confidence":15.040777477055167,"asi":{"hypothesis":"A non-inlined range-only binary helper will preserve fused local endpoints while avoiding repeated same/adjacent checks on distant fallbacks.","revisits_run":34,"changed_assumption":"Unlike run 34, the local path now owns and reuses endpoint values through weight calculation; only the cold binary loop is split out, and downward search uses the already-known tighter upper bound.","random_recovery":"locate1d random improves from 11.85 to 9.19 ns, interp1d random 15.57 to 13.43 ns, interp2d random 23.60 to 19.43 ns versus run 52.","learning":"Hot endpoint-aware locate plus a cold bounded binary helper is the best structure. Random combined 1D remains about 8% above pre-fusion, but broad primary improves another 4.9% while model-local gains remain."}}
{"run":54,"commit":"3fed49c","metric":8.369907,"metrics":{"one_d_ns":7.837485,"two_d_ns":8.938499,"scalar_ns":8.828101,"array_ns":6.411909,"locate1d_local_ns":4.622605,"eval2d_ebl_ns":4.422479,"max_cv_pct":4.440306},"status":"discard","description":"Moved cold binary search plus endpoint weighting into one tuple-return helper; call/return overhead severely hurt random paths and even local code layout regressed.","timestamp":1789419055956,"segment":0,"confidence":14.984994697453548,"asi":{"hypothesis":"Returning the complete cold locate result will shrink the inlined caller and avoid fallback endpoint reloads.","rollback_reason":"Primary regressed 5.0%; locate1d random rose from 9.19 to 13.59 ns and interp1d random from 13.43 to 17.08 ns. Local paths also slowed slightly.","next_action_hint":"Keep the cold helper index-only and calculate/reload endpoints in the inlined caller. Scalar index return ABI is much cheaper than tuple(index, weight).","learning":"Cold-path code size is less costly than tuple-return ABI overhead for random searches; run 53's range-only split is optimal."}}
{"run":55,"commit":"3fed49c","metric":7.95645,"metrics":{"one_d_ns":7.089076,"two_d_ns":8.92995,"scalar_ns":8.271227,"array_ns":6.553392,"locate1d_local_ns":4.564206,"eval2d_ebl_ns":4.415038,"max_cv_pct":3.894247},"status":"discard","description":"Cached the final interval index in fused locate; tiny aggregate movement hid consistent 1D regressions and inconsistent 2D code-layout gains.","timestamp":1789419128782,"segment":0,"confidence":14.878944184060275,"asi":{"hypothesis":"Reusing xp.size-2 in fused hot-path boundary checks and cold upper bounds will reduce repeated shape arithmetic.","rollback_reason":"The 0.14% primary gain is within noise and directly important 1D paths consistently regressed 2.5-3.7%; 2D improvements were likely caller register-layout effects.","next_action_hint":"Keep shape-bound expressions inline and let LLVM fold them per caller. Do not retain a live last-index value through the hot path.","learning":"As in run 41, explicit final-index locals destabilize register allocation rather than robustly reducing work."}}
{"run":56,"commit":"3fed49c","metric":7.980201,"metrics":{"one_d_ns":7.00923,"two_d_ns":9.085678,"scalar_ns":8.317192,"array_ns":6.489319,"locate1d_local_ns":4.441866,"eval2d_ebl_ns":4.418806,"max_cv_pct":5.657464},"status":"discard","description":"Specialized public 2D locate when both output buffers are supplied; optional branches were already eliminated and the direct gain was below noise.","timestamp":1789419212506,"segment":0,"confidence":14.77438418523824,"asi":{"hypothesis":"A branch-free generated overload implementation for supplied index/weight buffers will reduce 2D locate wrapper overhead.","rollback_reason":"Primary regressed about 0.16%; locate2d changed only from 14.65 to 14.47 ns, below noise, while the overload gained substantial duplicated code.","next_action_hint":"Keep the shared allocation wrapper. Numba already folds its optional-output branches for concrete buffer types.","learning":"The remaining buffered 2D locate cost is not optional-buffer dispatch."}}
{"run":57,"commit":"3f6bc07","metric":7.379021,"metrics":{"one_d_ns":6.331815,"two_d_ns":8.599424,"scalar_ns":7.780281,"array_ns":5.662606,"locate1d_local_ns":3.795045,"eval2d_ebl_ns":4.388108,"max_cv_pct":4.752415},"status":"keep","description":"Rewrote fused locate as early-return same/up/down/fallback paths; removing SSA merges improves every 1D case, random 2D, and arrays while retaining endpoint reuse.","timestamp":1789419329912,"segment":0,"confidence":15.58151276535803,"asi":{"hypothesis":"Early returns with branch-local endpoint names will eliminate Numba SSA phi complexity and improve code generation for the always-inlined locate helper.","local_locate_gain_pct":14.71,"random_locate_gain_pct":7.13,"pipeline_gain_pct":4.84,"array_1d_gain_pct":13.34,"array_2d_gain_pct":10.72,"random_2d_gain_pct":18.37,"local_2d_regression_pct":8.42,"learning":"SSA-friendly source structure is critical under Numba always-inlining. Branch-local returns outperform merged index/lower/upper state and are expected to reduce NumbaIRAssumptionWarnings; local 2D combined needs separate investigation."}}
{"run":58,"commit":"3f6bc07","metric":8.250454,"metrics":{"one_d_ns":6.308893,"two_d_ns":10.789531,"scalar_ns":8.907297,"array_ns":5.625193,"locate1d_local_ns":3.794195,"eval2d_ebl_ns":4.424023,"max_cv_pct":4.287699},"status":"discard","description":"Stopped forcing the C-layout fused scalar helper inline after its locate body grew; the resulting helper call more than doubled combined 2D overhead.","timestamp":1789419402867,"segment":0,"confidence":15.515189757847462,"asi":{"hypothesis":"Keeping the larger SSA-friendly locate body out of the caller may reduce code pressure and recover local 2D combined performance.","rollback_reason":"Primary regressed 11.8%; combined local/random jumped from 11.9/15.9 to 26.6/26.9 ns. The call boundary dominates despite larger inline code.","next_action_hint":"Keep _interp2d_scalar_c forced inline. Investigate its local regression through branch ordering or caller structure, not by restoring a helper call.","learning":"The C fused kernel must remain fully inline; its flat addressing and searches need cross-boundary scalarization."}}
