{"type":"config","name":"Optimize Numba 1D and 2D linear interpolation","metricName":"geomean_ns","metricUnit":"ns","bestDirection":"lower"}
{"run":1,"commit":"b1d8d84","metric":17.915014,"metrics":{"one_d_ns":15.370372,"two_d_ns":20.880934,"scalar_ns":19.189307,"array_ns":12.70593,"locate1d_local_ns":11.535329,"eval2d_ebl_ns":7.001653,"max_cv_pct":3.551751},"status":"checks_failed","description":"Initial frozen benchmark produced a valid timing baseline, but benchmark type checking rejected accumulator inference in the 2D locate driver.","timestamp":1789416014324,"segment":0,"confidence":null,"asi":{"hypothesis":"A balanced, core-pinned compiled benchmark can establish stable baseline timings for the target Numba call patterns.","rollback_reason":"The benchmark's interp2d_locate return was inferred by ty as scalar-or-array, making the accumulator's inferred type incompatible with the annotated float return.","next_action_hint":"Restructure the benchmark-only 2D locate accumulator to explicitly read scalar buffer elements without rebinding from the overloaded public return, then rerun baseline.","affinity":[0,1,2,3,4,5,6,7],"benchmark_valid":true}}
{"run":2,"commit":"b1d8d84","metric":17.744044,"metrics":{"one_d_ns":15.258661,"two_d_ns":20.634254,"scalar_ns":18.985141,"array_ns":12.654545,"locate1d_local_ns":11.416584,"eval2d_ebl_ns":6.956553,"max_cv_pct":4.587272},"status":"checks_failed","description":"Baseline verification after avoiding 2D locate return rebinding; benchmark ran correctly, but ty exposed the same public return-union inference for 2D evaluation.","timestamp":1789416055535,"segment":0,"confidence":null,"asi":{"hypothesis":"Ignoring the scalar locate return and consuming explicit output buffers would resolve the benchmark-only type ambiguity.","rollback_reason":"The locate ambiguity was resolved, but ty now inferred interp2d_eval as float-or-array and propagated that union into the accumulator.","next_action_hint":"Wrap the public interp2d_eval result with float() in the benchmark driver, matching the scalar Numba overload selected at runtime, then rerun baseline.","affinity":[0,1,2,3,4,5,6,7],"benchmark_valid":true}}
{"run":3,"commit":"6a2ffb3","metric":17.711749,"metrics":{"one_d_ns":15.154071,"two_d_ns":20.701108,"scalar_ns":18.885752,"array_ns":12.849827,"locate1d_local_ns":10.885206,"eval2d_ebl_ns":7.022314,"max_cv_pct":4.664907},"status":"keep","description":"Established the frozen CPU-0-7 baseline for compiled public 1D/2D interpolation workloads; all interpolation, lint, format, and type checks pass.","timestamp":1789416084493,"segment":0,"confidence":6.294008360427696,"asi":{"hypothesis":"The corrected broad benchmark provides a valid baseline for pydynopt-only call patterns, including JMP-like repeated scalar 2D field evaluation.","affinity":[0,1,2,3,4,5,6,7],"core_cases":12,"timing_samples":7,"target_sample_ms":40,"baseline_established":true}}
{"run":4,"commit":"6ea9524","metric":16.604015,"metrics":{"one_d_ns":13.562061,"two_d_ns":20.328275,"scalar_ns":18.177646,"array_ns":10.558214,"locate1d_local_ns":9.118526,"eval2d_ebl_ns":7.030052,"max_cv_pct":3.19761},"status":"keep","description":"Added one-interval upward/downward fast paths to bsearch_impl; large local-query and array gains outweighed a small random-search cost.","timestamp":1789416126655,"segment":0,"confidence":12.899407177822155,"asi":{"hypothesis":"The previous lower-bound hint usually differs by at most one interval in model loops, so explicit adjacent-bin checks will avoid binary search.","local_1d_gain_pct":16.23,"one_d_gain_pct":10.51,"array_gain_pct":17.83,"random_1d_regression_pct":1.04,"random_2d_regression_pct":4.45,"learning":"Adjacent-bin fast paths are highly valuable for local and sequential calls; distant random calls pay for the extra checks, so future search changes should avoid adding more linear probes."}}
{"run":5,"commit":"6ea9524","metric":11.747198,"metrics":{"one_d_ns":8.847336,"two_d_ns":15.59754,"scalar_ns":12.198302,"array_ns":9.729911,"locate1d_local_ns":6.830078,"eval2d_ebl_ns":6.932923,"max_cv_pct":4.13013},"status":"checks_failed","description":"Forced all small scalar interpolation helpers inline; performance improved dramatically, but Numba's compiler failed two public 2D path tests with SSA-scope errors.","timestamp":1789416181266,"segment":0,"confidence":6.449703588911078,"asi":{"hypothesis":"Explicit always-inlining of tiny scalar helpers will remove dispatcher/helper call overhead in compiled consumer loops.","rollback_reason":"Inlining the full helper stack triggered Numba IR/SSA assumption failures in public 2D scalar/array tests; 2 of 63 interpolation tests failed despite a 29% primary timing improvement.","next_action_hint":"Retry inlining in smaller subsets to identify a safe boundary, starting with interp1d_eval_scalar and interp2d_eval_scalar only; avoid nesting an always-inlined bsearch inside always-inlined locate initially.","performance_signal":"Very strong: interp1d combined fell from about 25-28 ns to 10-13 ns and interp2d combined from about 44-48 ns to 22-24 ns.","numba_failure":"NumbaIRAssumptionWarning variables from inlined interp1d_locate_scalar/bsearch_impl not in scope; public 2D scalar path and output-buffer identity tests failed."}}
{"run":6,"commit":"35ea189","metric":16.459931,"metrics":{"one_d_ns":13.558641,"two_d_ns":19.982041,"scalar_ns":18.00539,"array_ns":10.508855,"locate1d_local_ns":8.902212,"eval2d_ebl_ns":6.932487,"max_cv_pct":4.276531},"status":"keep","description":"Revisited run 5 with only 1D/2D evaluation helpers forced inline; checks now pass and the aggregate improves modestly without the nested-search SSA failure.","timestamp":1789416212957,"segment":0,"confidence":2.266284976477928,"asi":{"hypothesis":"Inlining only arithmetic evaluation helpers captures call-overhead gains without exposing Numba's nested bsearch SSA bug.","revisits_run":5,"changed_assumption":"The failed run conflated six inline decisions; limiting always-inline to leaf evaluation helpers avoids nested inlined control-flow.","learning":"Leaf eval helpers are safe to force inline. The gain is small for 2D repeated-field evaluation, implying Numba was already optimizing most of this path, while 1D pipeline and array paths gain more."}}
{"run":7,"commit":"d5156bb","metric":14.079558,"metrics":{"one_d_ns":10.751144,"two_d_ns":18.438404,"scalar_ns":15.037599,"array_ns":10.130749,"locate1d_local_ns":8.903812,"eval2d_ebl_ns":6.930531,"max_cv_pct":3.309296},"status":"keep","description":"Revisited run 5 by additionally inlining only fused 1D/2D scalar kernels; public checks pass and combined scalar calls become much faster.","timestamp":1789416255348,"segment":0,"confidence":3.3643495033898296,"asi":{"hypothesis":"Inlining fused scalar entry kernels, while leaving locate and initial-index helpers at normal inlining policy, will remove the dominant public-overload call boundary safely.","revisits_run":5,"changed_assumption":"The Numba SSA failure appears tied to forcing the locate/search helper stack inline, not to inlining fused scalar entry kernels around non-forced locate calls.","combined_1d_effect":"Local/random combined cases improved from about 25/28 ns before eval inlining to 13/15 ns.","combined_2d_effect":"Local/random combined cases improved from roughly 44/47 ns to 33/37 ns.","learning":"The main avoidable overhead was the fused public scalar kernel call boundary; leaf eval plus fused scalar inlining is Numba-safe."}}
{"run":8,"commit":"cb00266","metric":11.975886,"metrics":{"one_d_ns":8.86275,"two_d_ns":16.182545,"scalar_ns":12.549552,"array_ns":9.477743,"locate1d_local_ns":7.209398,"eval2d_ebl_ns":6.924405,"max_cv_pct":5.616811},"status":"keep","description":"Revisited locate inlining with bsearch_impl no longer forced inline; this avoids Numba's nested-inline SSA bug and captures most of the large search-path gain.","timestamp":1789416294672,"segment":0,"confidence":4.577165070332231,"asi":{"hypothesis":"Force-inlining locate while leaving bsearch as a normal compiled helper will flatten the public interpolation path without triggering nested-inline SSA corruption.","revisits_run":5,"changed_assumption":"The unsafe combination was nested forced inlining of bsearch into locate into 2D kernels; assigning the forced-inline boundary to locate alone is compiler-safe.","learning":"This recovered nearly all of run 5's performance while all 63 interpolation tests passed. bsearch's call boundary is cheaper than the locate/public scalar boundaries, and avoids a Numba 0.67/Python 3.14 compiler defect.","max_cv_note":"The highest per-case CV rose to 5.6%, but the primary improvement is roughly 15%, far beyond noise."}}
{"run":9,"commit":"cb00266","metric":11.786365,"metrics":{"one_d_ns":8.898802,"two_d_ns":15.610909,"scalar_ns":12.26261,"array_ns":9.668626,"locate1d_local_ns":7.201857,"eval2d_ebl_ns":6.923532,"max_cv_pct":4.280203},"status":"checks_failed","description":"Forced _initial_indices inline; 2D timings improved, but Numba failed to type the dead array-index branch when ilb was None in public array calls.","timestamp":1789416349470,"segment":0,"confidence":4.081642078149499,"asi":{"hypothesis":"Inlining the tiny initial-index decoder will remove residual 2D call overhead.","rollback_reason":"Numba's always-inline pipeline did not eliminate the ilb[0]/ilb[1] branch for a compile-time None argument, causing TypingError in two public 2D tests.","next_action_hint":"Do not force-inline the optional-argument helper directly. Consider overload-specific None/array implementations or specialize the public overload only if the added complexity is justified by the roughly 3.5% 2D gain.","performance_signal":"2D locate fell about 40.9 to 38.0 ns and combined local/random about 23.8/26.1 to 21.5/24.1 ns."}}
{"run":10,"commit":"cb00266","metric":11.957214,"metrics":{"one_d_ns":8.855005,"two_d_ns":16.146234,"scalar_ns":12.518032,"array_ns":9.508233,"locate1d_local_ns":6.86633,"eval2d_ebl_ns":6.672345,"max_cv_pct":4.223617},"status":"checks_failed","description":"Changed bilinear evaluation to interpolate along contiguous dimension 1 first, matching the target call pattern; timing was nearly neutral overall and checks failed only because Ruff required formatting.","timestamp":1789416468958,"segment":0,"confidence":2.3201671859486632,"asi":{"hypothesis":"Evaluating adjacent dimension-1 values before crossing rows will improve address generation and cache locality for C-order 2D arrays.","rollback_reason":"Code was semantically valid and tests passed up to the formatting gate, but ruff format --check rejected three line wraps.","next_action_hint":"Reapply the arithmetic-order change, run Ruff formatting before benchmarking, and verify whether the 3.6% repeated-eval gain survives while combined-path regressions settle.","performance_signal":"C-order repeated-field eval improved from about 6.95 to 6.53 ns and strided eval from 6.90 to 6.82 ns; combined 2D cases appeared 3-4% slower, leaving primary nearly unchanged."}}
{"run":11,"commit":"cb00266","metric":12.187165,"metrics":{"one_d_ns":8.835553,"two_d_ns":16.810151,"scalar_ns":12.855334,"array_ns":9.332525,"locate1d_local_ns":6.887122,"eval2d_ebl_ns":6.665965,"max_cv_pct":4.94159},"status":"discard","description":"Verification of dimension-1-first bilinear arithmetic after formatting; repeated eval improved, but fused 2D scalar paths regressed enough to worsen the aggregate.","timestamp":1789416527502,"segment":0,"confidence":2.546402785161809,"asi":{"hypothesis":"Contiguous-dimension-first bilinear evaluation will consistently improve 2D kernels once formatted and fully checked.","revisits_run":10,"rollback_reason":"Primary regressed about 1.8% versus run 8; 2D combined local/random rose from roughly 23.8/26.1 ns to 26.5/32.7 ns despite repeated eval improving about 3.7%.","next_action_hint":"Retain the original dimension-0-first arithmetic for broad performance. If optimizing repeated eval later, investigate a dedicated code-generation/addressing change that does not alter fused-kernel operation order.","learning":"Arithmetic order is specialization-sensitive: the pydynopt eval API benefits from contiguous-first loads, but inlined fused locate+eval code becomes materially worse, especially for random coordinates."}}
{"run":12,"commit":"9043f49","metric":11.650153,"metrics":{"one_d_ns":8.745287,"two_d_ns":15.51991,"scalar_ns":12.132539,"array_ns":9.511113,"locate1d_local_ns":6.811484,"eval2d_ebl_ns":6.929142,"max_cv_pct":5.256483},"status":"keep","description":"Revisited initial-index inlining with compile-time None/indexable overloads; specialization preserves all public paths and removes residual 2D helper overhead.","timestamp":1789416588049,"segment":0,"confidence":4.366712298022006,"asi":{"hypothesis":"A type-directed overload can inline separate None and indexable initial-index implementations without exposing invalid dead branches to Numba.","revisits_run":9,"changed_assumption":"Instead of forcing the polymorphic helper body inline, the overload generates a branch-free implementation for each compile-time argument type.","learning":"Compile-time overload specialization safely recovers the run 9 2D gains: locate improves about 6.8% and combined local about 9.7% versus run 8. 1D variation is noise because its production code is unchanged.","compiler_constraint":"Numba overload inline='always' is safe when each generated implementation is type-valid on its own."}}
{"run":13,"commit":"9043f49","metric":11.725474,"metrics":{"one_d_ns":8.859727,"two_d_ns":15.51817,"scalar_ns":12.237373,"array_ns":9.469817,"locate1d_local_ns":6.844742,"eval2d_ebl_ns":7.001146,"max_cv_pct":4.790025},"status":"discard","description":"Rewrote 1D interpolation as upper + weight*(lower-upper); fewer multiplies did not help the compiled pipeline and slightly worsened the aggregate.","timestamp":1789416626286,"segment":0,"confidence":11.66614712520389,"asi":{"hypothesis":"Difference-form linear interpolation will reduce arithmetic operations in all 1D evaluate paths.","rollback_reason":"Primary regressed about 0.65%; the representative locate-plus-four-evaluations pipeline rose from 8.04 to 8.26 ns, while combined improvements were too small to compensate.","next_action_hint":"Keep the weighted-sum formulation. Its independent multiplies likely expose more instruction-level parallelism than the shorter dependency chain in difference form.","learning":"Operation count alone is misleading for this tiny kernel; dependency depth dominates when several evaluations are accumulated."}}
{"run":14,"commit":"9043f49","metric":11.688456,"metrics":{"one_d_ns":8.758532,"two_d_ns":15.598505,"scalar_ns":12.211015,"array_ns":9.392565,"locate1d_local_ns":6.957434,"eval2d_ebl_ns":7.043154,"max_cv_pct":4.829638},"status":"discard","description":"Forced the allocating/output-buffer 2D scalar locate wrapper inline; Numba already eliminated its boundary and no target workload improved.","timestamp":1789416694431,"segment":0,"confidence":15.197821071706691,"asi":{"hypothesis":"Inlining interp2d_locate_scalar will expose supplied buffers, elide optional allocation branches, and remove tuple-return overhead.","rollback_reason":"Primary regressed about 0.33% and locate2d_local remained essentially unchanged at 38.07 ns versus 38.12 ns; observed variation elsewhere was noise.","next_action_hint":"Leave the wrapper at Numba's default policy. Focus on the internal 2D locate implementation or the two search calls rather than wrapper/tuple overhead.","learning":"The public overload/wrapper boundary is not the source of the remaining 2D locate cost when output buffers are supplied."}}
{"run":15,"commit":"474cd56","metric":11.351336,"metrics":{"one_d_ns":8.915047,"two_d_ns":14.453409,"scalar_ns":11.829582,"array_ns":9.234955,"locate1d_local_ns":6.941791,"eval2d_ebl_ns":6.943369,"max_cv_pct":4.28465},"status":"keep","description":"Forced the non-allocating 2D scalar locate implementation inline; this removes its real internal call boundary and sharply reduces buffered scalar locate cost.","timestamp":1789416722951,"segment":0,"confidence":20.150485213349608,"asi":{"hypothesis":"Inlining interp2d_locate_scalar_impl, rather than its allocation wrapper, will combine initial-index specialization and both searches directly in the wrapper caller.","locate2d_gain_pct":30.46,"array2d_gain_pct":5.97,"learning":"The internal scalar implementation boundary was costly: locate2d fell from about 38.1 to 26.5 ns. The allocation wrapper itself was not costly in run 14. This distinction should guide remaining array-kernel inlining."}}
{"run":16,"commit":"474cd56","metric":11.337726,"metrics":{"one_d_ns":8.813639,"two_d_ns":14.584672,"scalar_ns":11.759032,"array_ns":9.447088,"locate1d_local_ns":6.90259,"eval2d_ebl_ns":6.93365,"max_cv_pct":3.704847},"status":"discard","description":"Forced combined array loop implementations inline; the aggregate moved only within noise while the directly affected 2D array case regressed materially.","timestamp":1789416764171,"segment":0,"confidence":14.091027263525223,"asi":{"hypothesis":"Inlining the non-allocating combined array loops will enable cross-boundary loop optimization similar to the successful scalar 2D locate implementation.","rollback_reason":"The 0.12% apparent primary improvement is below run-to-run noise and came from unchanged scalar cases; array2d directly regressed about 5.0% (13.75 to 14.44 ns), and grouped array performance regressed about 2.3%.","next_action_hint":"Keep combined array loops out of line. Test narrower loop/indexing changes inside the implementations rather than forcing large loops into allocation wrappers.","learning":"Inlining benefits tiny straight-line internal implementations, but forcing full array loops increases code size without removing meaningful per-element overhead."}}
{"run":17,"commit":"474cd56","metric":11.402513,"metrics":{"one_d_ns":8.842322,"two_d_ns":14.703978,"scalar_ns":11.772097,"array_ns":9.721524,"locate1d_local_ns":6.819531,"eval2d_ebl_ns":6.934296,"max_cv_pct":2.936583},"status":"discard","description":"Revisited nested bsearch inlining after type-specializing initial indices; compiler checks now pass, but scalar paths do not improve and 2D array code regresses.","timestamp":1789416802123,"segment":0,"confidence":11.832821646256278,"asi":{"hypothesis":"With the actual None/indexable inline failure fixed by run 12, restoring bsearch always-inline may safely remove the final search call boundary.","revisits_run":5,"changed_assumption":"Run 12 replaced the unsafe polymorphic _initial_indices inlining, allowing a clean test of bsearch inlining by itself.","rollback_reason":"Although all checks now pass, primary regressed about 0.45%; scalar timings were unchanged and array2d rose roughly 11% from 13.75 to 15.31 ns due to nested code expansion.","next_action_hint":"Keep bsearch_impl at normal inline policy under the forced-inline locate function. The compiler call boundary has no scalar cost and controls array-loop code size.","learning":"Run 5's correctness failure was caused by optional initial-index inlining, but its nested bsearch inlining is still undesirable for performance."}}
{"run":18,"commit":"474cd56","metric":11.44759,"metrics":{"one_d_ns":8.959051,"two_d_ns":14.627367,"scalar_ns":11.876201,"array_ns":9.525698,"locate1d_local_ns":7.266649,"eval2d_ebl_ns":6.983286,"max_cv_pct":3.588583},"status":"discard","description":"Forced the public interp1d_eval overload implementation inline into consumers; repeated evaluation slowed, showing the remaining overload call in LLVM is beneficial for code size/scheduling.","timestamp":1789416878974,"segment":0,"confidence":14.69245508553112,"asi":{"hypothesis":"Inlining the outer public overload implementation will remove the remaining call visible in compiled benchmark LLVM.","rollback_reason":"Primary regressed about 0.85%; pipeline1d_4field rose from 8.08 to 8.29 ns and no directly affected case improved.","next_action_hint":"Retain the public overload boundary. Generated LLVM calls do not imply harmful overhead; leaf/internal inlining already exposes the arithmetic where beneficial.","learning":"Inlining across the public overload adds enough code pressure to outweigh a call removal in repeated-field loops."}}
{"run":19,"commit":"d0240e1","metric":11.03517,"metrics":{"one_d_ns":8.330117,"two_d_ns":14.618641,"scalar_ns":11.377344,"array_ns":9.472614,"locate1d_local_ns":5.897434,"eval2d_ebl_ns":6.948989,"max_cv_pct":4.074379},"status":"keep","description":"Forced only the public interp1d_locate overload inline; tuple/call overhead disappears in EBL-style locate and locate-plus-multiple-eval loops.","timestamp":1789416913382,"segment":0,"confidence":17.16527944111775,"asi":{"hypothesis":"Unlike repeated eval, public locate returns a tuple and carries a search hint, so inlining its outer overload can remove meaningful tuple/call overhead.","local_locate_gain_pct":15.05,"pipeline_1d_gain_pct":13.72,"random_locate_gain_pct":10.77,"learning":"Public-overload inlining should be selective: it strongly benefits locate but harmed eval in run 18. EBL's locate-once/evaluate-many pattern now improves directly."}}
