{"run":20,"commit":"13cc820","metric":10.759181,"metrics":{"one_d_ns":8.179839,"two_d_ns":14.151865,"scalar_ns":11.01672,"array_ns":9.559029,"locate1d_local_ns":5.643274,"eval2d_ebl_ns":6.938056,"max_cv_pct":3.203143},"status":"keep","description":"Forced the public interp2d_locate overload inline; buffered scalar locate now sheds its outer wrapper/tuple boundary and drops to about 22 ns.","timestamp":1789416944439,"segment":0,"confidence":17.122720077910664,"asi":{"hypothesis":"The successful public 1D locate strategy should transfer to 2D locate, where returned buffer tuples cross the same overload boundary.","locate2d_gain_pct":17.13,"learning":"Selective public locate inlining works in both dimensions. Combined/eval APIs do not inherit this benefit because they use different overload paths; array2d variation is unrelated noise."}}
{"run":21,"commit":"13cc820","metric":10.803135,"metrics":{"one_d_ns":8.219778,"two_d_ns":14.198405,"scalar_ns":11.051899,"array_ns":9.640828,"locate1d_local_ns":5.805325,"eval2d_ebl_ns":6.941158,"max_cv_pct":2.325752},"status":"discard","description":"Forced the public combined 1D overload inline; unlike locate, it did not improve scalar interpolation and enlarged the array path.","timestamp":1789416977652,"segment":0,"confidence":17.475756584088813,"asi":{"hypothesis":"Public overload inlining will remove the remaining combined 1D call boundary just as it did for locate.","rollback_reason":"Primary regressed about 0.4%; directly affected interp1d_local rose from 10.09 to 10.24 ns and array1d from 6.27 to 6.38 ns, with no consistent combined benefit.","next_action_hint":"Keep public inlining limited to locate overloads. Fused scalar internals are already inlined enough; forcing the outer combined overload adds code pressure.","learning":"Tuple-return/search-hint locate calls are special. The same public-inline policy does not generalize to combined interpolation."}}
{"run":22,"commit":"356eba7","metric":10.67758,"metrics":{"one_d_ns":8.126538,"two_d_ns":14.029432,"scalar_ns":10.985259,"array_ns":9.263722,"locate1d_local_ns":5.63986,"eval2d_ebl_ns":7.054963,"max_cv_pct":2.474037},"status":"keep","description":"Cached lower and upper grid values before computing interpolation weight; this avoids repeated indexed expressions and improves locate-heavy and 2D array paths.","timestamp":1789417010245,"segment":0,"confidence":17.04050320270201,"asi":{"hypothesis":"Explicit lower/upper grid locals will help Numba retain loaded endpoints across the weight numerator and denominator.","locate2d_gain_pct":2.5,"array2d_gain_pct":4.98,"learning":"Numba did not generate equally efficient code from repeated xp[index+1] expressions. Explicit endpoint locals are both clearer and faster. The unchanged eval-only variation is noise."}}
{"run":23,"commit":"c722c6c","metric":10.589497,"metrics":{"one_d_ns":8.1263,"two_d_ns":13.799325,"scalar_ns":10.835843,"array_ns":9.439274,"locate1d_local_ns":5.626155,"eval2d_ebl_ns":6.661056,"max_cv_pct":3.048248},"status":"keep","description":"Cached four 2D corner values and the repeated dimension-0 complement in scalar evaluation; repeated-field evaluation improves for both contiguous and strided arrays.","timestamp":1789417073416,"segment":0,"confidence":15.866709552492898,"asi":{"hypothesis":"Explicit corner and complement locals will reduce repeated address arithmetic and expose reusable values in the inlined 2D scalar evaluator.","eval2d_gain_pct":5.58,"learning":"Unlike changing interpolation order, preserving the existing arithmetic tree while naming corner loads/complement improves both C-contiguous and strided repeated-field calls. This is the appropriate optimization pattern for duplicated 2D arithmetic."}}
{"run":24,"commit":"c722c6c","metric":10.695196,"metrics":{"one_d_ns":8.205599,"two_d_ns":13.940142,"scalar_ns":10.958262,"array_ns":9.471616,"locate1d_local_ns":5.624633,"eval2d_ebl_ns":6.663918,"max_cv_pct":1.997561},"status":"discard","description":"Applied explicit corner/complement locals to fused 2D scalar interpolation; the optimization did not transfer from eval-only and slightly worsened the aggregate.","timestamp":1789417112865,"segment":0,"confidence":12.717966657841403,"asi":{"hypothesis":"The corner-load optimization from run 23 will also improve duplicate bilinear arithmetic in fused 2D scalar interpolation.","rollback_reason":"Primary regressed about 1.0%; interp2d_local rose from 21.36 to 21.76 ns, while the random case's small gain did not generalize.","next_action_hint":"Keep explicit corners only in interp2d_eval_scalar. In fused code, surrounding search creates different register pressure; do not mechanically duplicate the eval-only optimization.","learning":"Identical arithmetic benefits depend on surrounding live values. Fused locate+evaluate has higher register pressure and is hurt by four named corner temporaries."}}
{"run":25,"commit":"34e03d7","metric":10.543709,"metrics":{"one_d_ns":8.116604,"two_d_ns":13.69659,"scalar_ns":10.808601,"array_ns":9.313505,"locate1d_local_ns":5.660546,"eval2d_ebl_ns":6.345701,"max_cv_pct":2.724839},"status":"keep","description":"Forced the public 2D eval overload inline; strided-view evaluation benefits strongly, outweighing a modest contiguous-layout regression.","timestamp":1789417192347,"segment":0,"confidence":11.283427166662081,"asi":{"hypothesis":"Inlining public 2D eval can scalarize index/weight row views in JMP-like repeated-field callers, unlike scalar-argument 1D eval.","strided_eval_gain_pct":12.56,"contiguous_eval_regression_pct":3.8,"learning":"Public 2D eval inlining is layout-sensitive: it substantially improves strided fp[:, 0]-style views while slightly hurting contiguous fp[0]-style views. Both are represented equally, so the grouped result improves about 4.7%.","next_action_hint":"Investigate a layout-sensitive inline policy or implementation split to retain the strided gain without the contiguous regression."}}
{"run":26,"commit":"34e03d7","metric":0,"metrics":{"one_d_ns":0,"two_d_ns":0,"scalar_ns":0,"array_ns":0,"locate1d_local_ns":0,"eval2d_ebl_ns":0,"max_cv_pct":0},"status":"crash","description":"Tried a layout-sensitive Numba overload inline policy for 2D eval, but Numba 0.67 invokes custom policies with three arguments rather than the two documented in its public docstring.","timestamp":1789417257321,"segment":0,"confidence":11.283427166662081,"asi":{"hypothesis":"A custom overload inline policy can inline arbitrary-strided 2D evaluation while keeping C-contiguous evaluation out of line.","rollback_reason":"Compilation crashed before measurement: _inline_interp2d_eval() takes 2 positional arguments but 3 were given.","next_action_hint":"Retry the policy with the actual three-argument signature observed in numba.core.typed_passes and inspect those argument structures before selecting fp layout.","error_type":"TypeError","numba_version_behavior":"Custom inline policy invoked as policy(expr, caller_inline_info, callee_inline_info)."}}
{"run":27,"commit":"34e03d7","metric":10.530235,"metrics":{"one_d_ns":8.159645,"two_d_ns":13.589545,"scalar_ns":10.781775,"array_ns":9.357876,"locate1d_local_ns":5.697087,"eval2d_ebl_ns":6.238133,"max_cv_pct":2.543422},"status":"checks_failed","description":"Corrected the three-argument layout-sensitive inline policy; desired C/strided timings were achieved, but Numba failed lowering the array-eval output-buffer specialization when the policy returned false.","timestamp":1789417316421,"segment":0,"confidence":9.826415179856895,"asi":{"hypothesis":"Inline scalar 2D eval only when fp has arbitrary-strided layout, restoring C-layout performance while retaining the strided gain.","rollback_reason":"One public output-buffer test failed: Numba's custom cost-model false path attempted to cast a supplied 1D output array to omitted(default=None) while lowering the index.ndim>1 eval implementation.","next_action_hint":"Retry with the policy always returning true for array-index eval paths (index ndim > 1), and layout-selective behavior only for scalar index.ndim == 1. This should avoid Numba's false-path lowering defect for the direct array implementation.","performance_signal":"The intended scalar result worked: C eval returned to 6.76 ns and strided stayed near 5.76 ns, grouped 6.24 ns."}}
{"run":28,"commit":"34e03d7","metric":10.447255,"metrics":{"one_d_ns":8.112113,"two_d_ns":13.454588,"scalar_ns":10.710571,"array_ns":9.224652,"locate1d_local_ns":5.629515,"eval2d_ebl_ns":6.241856,"max_cv_pct":2.057944},"status":"checks_failed","description":"Retried layout-sensitive 2D eval policy with array paths forced inline; scalar timings and aggregate improved, but Numba's custom inliner hit a folded-argument KeyError on keyword output buffers.","timestamp":1789417365158,"segment":0,"confidence":8.702654489042732,"asi":{"hypothesis":"Always inlining index.ndim>1 eval avoids the custom-policy false-path cast bug while preserving layout selection for scalar eval.","revisits_run":27,"changed_assumption":"The array path was changed from policy false to true to avoid the prior omitted-output cast.","rollback_reason":"Numba still failed the output-buffer specialization, now with KeyError 'iinfo' after custom inliner argument folding for the direct interp2d_eval_array implementation.","next_action_hint":"Wrap the array implementation in a generated impl whose full signature/defaults exactly match the overloaded public function before applying the custom policy; direct return of interp2d_eval_array exposes a Numba cost-model bug.","performance_signal":"Desired core score reached 10.447 ns; C/strided eval were 6.77/5.76 ns."}}
{"run":29,"commit":"34e03d7","metric":10.481836,"metrics":{"one_d_ns":8.106062,"two_d_ns":13.553916,"scalar_ns":10.726493,"array_ns":9.339754,"locate1d_local_ns":5.624699,"eval2d_ebl_ns":6.227795,"max_cv_pct":2.55042},"status":"checks_failed","description":"Retried layout-sensitive 2D eval with a signature-matching array wrapper; cost-model folding progressed, but the nested wrapper could not type the plain allocation function.","timestamp":1789417411958,"segment":0,"confidence":9.601635245439855,"asi":{"hypothesis":"A generated array overload implementation matching public defaults will avoid Numba's keyword-output folding bugs while leaving array eval out of line.","revisits_run":28,"changed_assumption":"The direct interp2d_eval_array implementation was replaced with a matching nested wrapper so cost-model argument folding sees the public signature.","rollback_reason":"Numba could not type the nested wrapper's call to plain interp2d_eval_array; two array-eval public tests failed before lowering.","next_action_hint":"Retry by putting the two-line allocation/output-buffer logic directly in the generated implementation and calling the already register_jitable interp2d_eval_array_impl.","performance_signal":"Scalar layout policy remains promising: grouped eval 6.228 ns and primary 10.482 ns."}}
{"run":30,"commit":"34e03d7","metric":10.492877,"metrics":{"one_d_ns":8.098387,"two_d_ns":13.595356,"scalar_ns":10.739777,"array_ns":9.34095,"locate1d_local_ns":5.618543,"eval2d_ebl_ns":6.232362,"max_cv_pct":2.716861},"status":"checks_failed","description":"Inlined the array allocation logic inside a matching generated overload implementation; Numba still failed the custom cost-model false path for keyword output buffers.","timestamp":1789417464479,"segment":0,"confidence":9.966947233208257,"asi":{"hypothesis":"Direct generated allocation logic will make custom-policy argument folding type-correct for array 2D eval.","revisits_run":29,"changed_assumption":"The untyped plain wrapper call was removed and replaced by inline allocation plus the registered array kernel.","rollback_reason":"The same supplied-output-to-omitted cast failure remained, proving the bug is in Numba's custom cost-model false path with keyword/default folding, not the selected implementation body.","next_action_hint":"Abandon callable cost models. Register a separate always-inline overload that accepts only scalar index plus A-layout fp, and make the normal overload reject that exact type so each signature has one implementation/policy.","learning":"No implementation wrapper can repair this Numba 0.67 custom inliner bug; specialization must occur through separate overload templates."}}
{"run":31,"commit":"d9853d7","metric":10.495153,"metrics":{"one_d_ns":8.131591,"two_d_ns":13.545717,"scalar_ns":10.74813,"array_ns":9.316826,"locate1d_local_ns":5.658239,"eval2d_ebl_ns":6.232291,"max_cv_pct":2.414071},"status":"keep","description":"Split 2D eval into a strided scalar always-inline overload and a normal generic overload; this avoids Numba's cost-model bugs and retains both layout-specific strengths.","timestamp":1789417519923,"segment":0,"confidence":10.04498123976614,"asi":{"hypothesis":"Separate overload templates with mutually exclusive accepted signatures can express layout-sensitive inlining without a callable Numba cost model.","revisits_run":30,"changed_assumption":"The custom cost model was removed entirely; the always-inline template accepts only scalar index plus A-layout fp, while the normal template rejects that signature and handles C/array paths.","learning":"Template-level specialization works around Numba 0.67's custom-inliner keyword/default bugs. C evaluation is about 6.77 ns and strided about 5.74 ns, grouped 6.23 ns, with all public output-buffer paths passing."}}
{"run":32,"commit":"d9853d7","metric":10.518442,"metrics":{"one_d_ns":8.142753,"two_d_ns":13.587249,"scalar_ns":10.767149,"array_ns":9.358468,"locate1d_local_ns":5.622452,"eval2d_ebl_ns":6.22854,"max_cv_pct":3.434963},"status":"discard","description":"Replaced binary-search branch updates with select-style conditional assignments; random searches did not improve and the aggregate moved backward.","timestamp":1789417562358,"segment":0,"confidence":10.235236911549066,"asi":{"hypothesis":"Branchless lower/upper updates will reduce misprediction cost in distant random binary searches while leaving adjacent fast paths untouched.","rollback_reason":"Primary regressed about 0.22%; locate1d_random stayed near 9.91 ns and interp1d_random worsened from 12.48 to 12.75 ns.","next_action_hint":"Retain the explicit branch. LLVM may already lower it efficiently, and dual select updates add data dependencies without reducing measured mispredictions.","learning":"The random fallback is not improved by source-level branchless assignments."}}
{"run":33,"commit":"d9853d7","metric":10.498785,"metrics":{"one_d_ns":8.118656,"two_d_ns":13.57669,"scalar_ns":10.737698,"array_ns":9.381629,"locate1d_local_ns":5.620124,"eval2d_ebl_ns":6.22233,"max_cv_pct":1.966778},"status":"discard","description":"Hoisted .flat iterator objects out of combined array loops; Numba already hoisted equivalent metadata and array performance did not improve.","timestamp":1789417635969,"segment":0,"confidence":9.981168598816751,"asi":{"hypothesis":"Caching flat iterators will avoid repeated .flat property construction and shape/stride lookup per array element.","rollback_reason":"Primary was effectively unchanged but slightly worse; array1d rose from 6.04 to 6.13 ns and array2d was unchanged around 14.36 ns.","next_action_hint":"Keep direct .flat indexing. To improve arrays, specialize actual memory layouts or reduce per-element interpolation work rather than naming iterator objects.","learning":"Numba already optimizes repeated .flat access; explicit flat iterator locals provide no benefit."}}
{"run":34,"commit":"d9853d7","metric":10.493775,"metrics":{"one_d_ns":8.083335,"two_d_ns":13.623004,"scalar_ns":10.693245,"array_ns":9.550869,"locate1d_local_ns":5.583796,"eval2d_ebl_ns":6.227898,"max_cv_pct":3.576168},"status":"discard","description":"Split bsearch into an inlined adjacent fast path and out-of-line range fallback; EBL-style locate improved, but fused and array paths regressed, leaving the primary unchanged.","timestamp":1789417719083,"segment":0,"confidence":9.739408195169842,"asi":{"hypothesis":"Inlining only bsearch's same/adjacent checks while keeping the binary loop out of line will remove calls on local queries without array code expansion.","rollback_reason":"The 0.013% primary difference is pure noise; although pipeline1d improved about 4%, interp1d_local regressed about 3.1% and grouped arrays regressed about 2.5%, with substantially longer compilation/check time.","next_action_hint":"Retain the simpler single bsearch helper. The public 1D locate inlining already captures most model-use performance; splitting search redistributes codegen quality rather than improving it broadly.","learning":"Separating hot/cold search paths benefits explicit locate-once pipelines but harms fused and array callers through code layout/pressure."}}
{"run":35,"commit":"d9853d7","metric":10.481808,"metrics":{"one_d_ns":8.139988,"two_d_ns":13.497354,"scalar_ns":10.742493,"array_ns":9.27026,"locate1d_local_ns":5.63606,"eval2d_ebl_ns":6.229627,"max_cv_pct":2.597611},"status":"discard","description":"Set NumPy division error semantics on the unchecked locate helper to remove zero-denominator handling; measured improvement was below noise and locate timings were unchanged.","timestamp":1789417791237,"segment":0,"confidence":9.537979093180857,"asi":{"hypothesis":"The strict-increasing-grid precondition makes zero-division handling unnecessary, so error_model='numpy' may shorten weight calculation.","rollback_reason":"The 0.13% primary improvement is below noise; directly affected 1D locate remained 5.64 ns and other changed cases varied inconsistently. The semantic change is not justified without a clear gain.","next_action_hint":"Retain default error semantics. Runtime zero checks are either optimized or correctly predicted and are not a meaningful bottleneck.","learning":"Changing Numba's division error model provides no reliable performance benefit for interpolation weights."}}
{"run":36,"commit":"d9853d7","metric":10.536948,"metrics":{"one_d_ns":8.177527,"two_d_ns":13.57712,"scalar_ns":10.761701,"array_ns":9.481661,"locate1d_local_ns":5.626228,"eval2d_ebl_ns":6.230802,"max_cv_pct":2.923665},"status":"discard","description":"Cached the repeated dimension-0 complement in the fused 2D array loop; compiler behavior and array timing were unchanged while the aggregate varied negatively.","timestamp":1789417839192,"segment":0,"confidence":9.344713022517146,"asi":{"hypothesis":"Naming 1-weight0 once will reduce repeated arithmetic in every 2D array element without the register pressure of four corner locals.","rollback_reason":"Primary regressed about 0.4%; the directly affected array2d case remained essentially unchanged at 14.38 versus 14.36 ns.","next_action_hint":"Do not pursue source-level common-subexpression naming in the array loop; LLVM already performs it. Consider layout specialization or loop structure instead.","learning":"The scalar eval gain in run 23 came from explicit corner addressing, not merely naming the repeated weight complement."}}
{"run":37,"commit":"5933534","metric":10.4868,"metrics":{"one_d_ns":8.112376,"two_d_ns":13.556198,"scalar_ns":10.729951,"array_ns":9.351242,"locate1d_local_ns":5.661913,"eval2d_ebl_ns":6.163707,"max_cv_pct":2.640936},"status":"keep","description":"Reordered explicit 2D corner loads by contiguous rows while preserving the original arithmetic tree; C-layout repeated evaluation improves and strided performance is retained.","timestamp":1789417894489,"segment":0,"confidence":11.2190113568828,"asi":{"hypothesis":"Loading each row's adjacent corners together will improve C-layout address generation without the arithmetic-order regression from run 11.","contiguous_eval_gain_pct":2.14,"strided_eval_change_pct":-0.03,"learning":"Source load order matters even though the arithmetic tree is unchanged. This recovers contiguous locality while preserving the specialized strided path; unchanged locate variation is noise.","confidence_note":"Aggregate gain is diluted because only one of twelve cases changes, but the directly affected C case improves about 2.1% and the code is simpler in memory order."}}
{"run":38,"commit":"5933534","metric":10.534584,"metrics":{"one_d_ns":8.148376,"two_d_ns":13.619579,"scalar_ns":10.779285,"array_ns":9.39192,"locate1d_local_ns":5.623216,"eval2d_ebl_ns":6.301624,"max_cv_pct":2.51276},"status":"discard","description":"Cached upper 2D corner indices before scalar evaluation; extra live index values hurt the strided specialization and worsened the aggregate.","timestamp":1789417927957,"segment":0,"confidence":13.697786989690053,"asi":{"hypothesis":"Precomputing index0+1 and index1+1 will reduce repeated integer address arithmetic for four corner loads.","rollback_reason":"Primary regressed about 0.46%; strided eval rose from 5.74 to 5.88 ns and C eval also worsened, indicating added register/live-range cost.","next_action_hint":"Keep index increments directly in corner subscripts. The backend already folds them into addressing modes.","learning":"Explicit grid-value locals help, but explicit upper-index locals prevent efficient address-mode folding or increase register pressure."}}
