{"run":59,"commit":"efd4c70","metric":7.333094,"metrics":{"one_d_ns":6.28848,"two_d_ns":8.551235,"scalar_ns":7.745741,"array_ns":5.577104,"locate1d_local_ns":3.783418,"eval2d_ebl_ns":4.363021,"max_cv_pct":5.031848},"status":"keep","description":"Located contiguous/fast-moving dimension 1 before dimension 0 in the C-layout fused scalar kernel; local combined calls improve with a small random-case tradeoff.","timestamp":1789419467802,"segment":0,"confidence":14.236721251043521,"asi":{"hypothesis":"In the JMP-like C-layout call pattern, searching the large fast-moving contiguous dimension before the small slow-moving dimension will improve instruction/branch scheduling.","combined_local_gain_pct":3.78,"combined_random_regression_pct":1.87,"learning":"Search order matters in fully inlined C-layout combined code. Dimension 1 first favors the representative local pattern and improves the balanced primary; generic-layout and separate locate APIs retain dimension-0-first order."}}
{"run":60,"commit":"efd4c70","metric":7.383681,"metrics":{"one_d_ns":6.304038,"two_d_ns":8.648224,"scalar_ns":7.814965,"array_ns":5.55907,"locate1d_local_ns":3.798353,"eval2d_ebl_ns":4.452298,"max_cv_pct":4.460951},"status":"discard","description":"Reordered searches in the buffered 2D locate implementation; unlike fused C interpolation, dimension 1 first worsened standalone locate.","timestamp":1789419512848,"segment":0,"confidence":12.916058411979245,"asi":{"hypothesis":"Dimension-1-first search order from run 59 will also benefit standalone buffered 2D locate.","rollback_reason":"Primary regressed about 0.69%; directly affected locate2d rose from 13.63 to 14.01 ns. The benefit is specific to fused C-layout scheduling, not search alone.","next_action_hint":"Keep standalone 2D locate dimension 0 first. Do not generalize run 59's order to other kernels.","learning":"Search ordering interacts with subsequent flat bilinear arithmetic; without that arithmetic, original dimension order is faster."}}
{"run":61,"commit":"efd4c70","metric":7.363221,"metrics":{"one_d_ns":6.332148,"two_d_ns":8.562185,"scalar_ns":7.81319,"array_ns":5.473502,"locate1d_local_ns":3.797558,"eval2d_ebl_ns":4.439529,"max_cv_pct":3.987836},"status":"discard","description":"Reordered searches in fused 2D array interpolation; the target array case improved, but unrelated scalar noise left the primary worse.","timestamp":1789419562337,"segment":0,"confidence":12.659048291248826,"asi":{"hypothesis":"Searching fast-moving dimension 1 first inside the fused array loop will improve its per-element scheduling.","rollback_reason":"Primary regressed about 0.41% despite array2d improving 4.3% from 8.14 to 7.79 ns; unchanged scalar/random cases supplied the opposing movement.","next_action_hint":"Re-run this one-line ordering change once because the directly affected signal is strong and expected aggregate effect is only about 0.36%, easily hidden by suite noise.","direct_signal":"array2d_local improved from 8.14 to 7.79 ns."}}
{"run":62,"commit":"efd4c70","metric":7.380345,"metrics":{"one_d_ns":6.365906,"two_d_ns":8.556438,"scalar_ns":7.837978,"array_ns":5.463105,"locate1d_local_ns":3.795496,"eval2d_ebl_ns":4.429722,"max_cv_pct":4.056079},"status":"discard","description":"Verification of dimension-1-first fused array search reproduced the array gain, but the balanced primary again failed to improve.","timestamp":1789419615462,"segment":0,"confidence":12.412066844094957,"asi":{"hypothesis":"The direct 4.3% array2d improvement from run 61 will translate to an aggregate gain on confirmation.","revisits_run":61,"changed_assumption":"Run 61's unchanged scalar movement could have hidden the expected roughly 0.36% primary benefit, so the identical change was repeated.","rollback_reason":"array2d reproduced at 7.80 ns, but primary again regressed, now about 0.64%; two runs did not satisfy the frozen balanced acceptance metric.","next_action_hint":"Retain dimension-0-first array order despite the isolated benchmark signal. Do not tune further to this single case.","learning":"The direct array effect is real but too narrow to improve the balanced suite reliably, so keeping it would overfit one workload."}}
{"run":63,"commit":"c5905a6","metric":7.263963,"metrics":{"one_d_ns":6.166711,"two_d_ns":8.556452,"scalar_ns":7.642634,"array_ns":5.634128,"locate1d_local_ns":3.473818,"eval2d_ebl_ns":4.391197,"max_cv_pct":4.683786},"status":"keep","description":"Restored NaN hint semantics by retaining the original lower-search upper bound; the simpler bound also improves scalar locate performance and the primary metric.","timestamp":1789419811251,"segment":0,"confidence":12.104079126728562,"asi":{"hypothesis":"Using the original hint as the downward binary-search upper bound preserves unordered-NaN behavior and may compile more efficiently than the tightened index-minus-one bound.","semantic_fix":"For NaN with ilb>=2, index-1 was not a proven upper bound because comparisons are unordered; it returned one interval below the Python/bsearch path. Added compiled-vs-Python regression coverage.","locate_random_gain_pct":7.16,"locate_local_gain_pct":8.18,"tradeoff":"interp1d_random rose about 2.1% and array1d about 2.5%, while scalar locate and aggregate improved.","learning":"A mathematically tighter bound for ordered values was invalid for NaN and generated worse code. Preserve the original search bound."}}
{"run":64,"commit":"8187f77","metric":7.247156,"metrics":{"one_d_ns":6.105533,"two_d_ns":8.602243,"scalar_ns":7.652517,"array_ns":5.520574,"locate1d_local_ns":3.465346,"eval2d_ebl_ns":4.411177,"max_cv_pct":5.498929},"status":"keep","description":"Hoisted the extrapolation mode outside the 1D array loop and added a direct extrapolating loop; array interpolation avoids a per-element mode branch and improves about 5%.","timestamp":1789419997583,"segment":0,"confidence":11.7570291835655,"asi":{"hypothesis":"A dedicated extrapolating 1D array loop will hoist the invariant mode branch and expose direct interpolation arithmetic, avoiding per-element helper control flow.","array_1d_gain_pct":5.16,"primary_gain_pct":0.23,"learning":"LLVM did not fully recover the optimal extrapolate=True array loop through the shared evaluator; source-level loop versioning gives a narrow but reproducible direct-path gain."}}
{"run":65,"commit":"7f9774b","metric":7.219399,"metrics":{"one_d_ns":6.12409,"two_d_ns":8.510607,"scalar_ns":7.676026,"array_ns":5.312811,"locate1d_local_ns":3.469881,"eval2d_ebl_ns":4.398198,"max_cv_pct":4.408439},"status":"keep","description":"Hoisted extrapolation mode outside the 2D array loop and added a direct extrapolating loop; array2d improves about 7% and the primary metric falls further.","timestamp":1789420068833,"segment":0,"confidence":11.744137464938426,"asi":{"hypothesis":"The successful 1D array loop versioning from run 64 will transfer to 2D, removing invariant extrapolation control flow from every element.","array_2d_gain_pct":7.17,"primary_gain_pct":0.38,"learning":"Source-level extrapolation loop versioning benefits both 1D and 2D arrays; the larger 2D loop sees an even stronger direct gain."}}
{"run":66,"commit":"16ff8f3","metric":7.197783,"metrics":{"one_d_ns":6.110257,"two_d_ns":8.47887,"scalar_ns":7.667179,"array_ns":5.248246,"locate1d_local_ns":3.484045,"eval2d_ebl_ns":4.440175,"max_cv_pct":4.514509},"status":"keep","description":"Loaded extrapolating 2D array corners in contiguous row order before bilinear arithmetic; array2d and the primary metric improve further.","timestamp":1789420162174,"segment":0,"confidence":11.742324156541951,"asi":{"hypothesis":"After loop versioning, explicit row-contiguous corner loads in the extrapolating 2D array loop will reduce multidimensional address scheduling overhead.","array_2d_gain_pct":1.62,"primary_gain_pct":0.3,"changed_assumption":"Earlier fused scalar corner locals suffered register pressure, but the versioned array loop has no extrapolation condition and amortizes stable row-wise load scheduling.","learning":"The row-order corner-load optimization transfers to the dedicated extrapolating array loop, though its gain is smaller than in eval-only scalar code."}}
{"run":67,"commit":"16ff8f3","metric":7.301303,"metrics":{"one_d_ns":6.242234,"two_d_ns":8.540055,"scalar_ns":7.772856,"array_ns":5.33948,"locate1d_local_ns":3.527019,"eval2d_ebl_ns":4.457681,"max_cv_pct":5.288486},"status":"discard","description":"Cached the dimension-0 complement in the versioned 2D array loop; added live state hurt array and aggregate performance.","timestamp":1789420210534,"segment":0,"confidence":11.71901967816856,"asi":{"hypothesis":"Explicitly reusing 1-weight0 after row-ordered corner loads will remove duplicate subtraction in the extrapolating 2D array loop.","revisits_run":36,"changed_assumption":"The loop is now versioned and corners are explicitly loaded row-wise, so complement reuse could have become visible to code generation.","rollback_reason":"Primary regressed 1.44% and array2d rose from 7.49 to 7.66 ns; LLVM already eliminates or schedules the duplicate expression better than the extra source local.","next_action_hint":"Keep direct complement expressions in the versioned array loop; do not add more arithmetic temporaries."}}
{"run":68,"commit":"16ff8f3","metric":7.262893,"metrics":{"one_d_ns":6.203716,"two_d_ns":8.502906,"scalar_ns":7.734252,"array_ns":5.303549,"locate1d_local_ns":3.70186,"eval2d_ebl_ns":4.422332,"max_cv_pct":4.78114},"status":"discard","description":"Named 1D array value endpoints before weighted evaluation; direct loads already compiled optimally and the aggregate regressed.","timestamp":1789420283339,"segment":0,"confidence":11.695807519335265,"asi":{"hypothesis":"Explicit fp endpoint locals in the dedicated extrapolating 1D array loop will improve load scheduling after loop versioning.","revisits_run":39,"changed_assumption":"The change was limited to the newly versioned extrapolating array loop rather than the shared scalar evaluator.","rollback_reason":"Primary regressed about 0.9% and array1d stayed effectively unchanged at 3.71 ns; explicit endpoint names provide no direct benefit.","next_action_hint":"Keep direct fp subscripts in the 1D array loop; pursue loop-level rather than load-naming changes."}}
{"run":69,"commit":"16ff8f3","metric":7.211235,"metrics":{"one_d_ns":6.108278,"two_d_ns":8.513349,"scalar_ns":7.695228,"array_ns":5.211352,"locate1d_local_ns":3.469482,"eval2d_ebl_ns":4.433357,"max_cv_pct":4.363639},"status":"discard","description":"Retried flat row-major corner offsets inside the versioned 2D array loop; array2d improved narrowly, but the balanced primary did not.","timestamp":1789420360578,"segment":0,"confidence":11.455883453302008,"asi":{"hypothesis":"With early-return locate, loop versioning, and row-wise corner locals, flat offsets may now transfer the scalar C-layout addressing gain to array2d.","revisits_run":45,"changed_assumption":"The array loop has since shed extrapolation control flow and materially lower search/register pressure.","rollback_reason":"array2d improved from 7.49 to 7.36 ns, but primary regressed 0.19%; the narrow gain again failed balanced acceptance.","next_action_hint":"Retain multidimensional row-ordered loads. Do not retry flat array offsets."}}
{"run":70,"commit":"16ff8f3","metric":7.191723,"metrics":{"one_d_ns":6.116868,"two_d_ns":8.455451,"scalar_ns":7.639595,"array_ns":5.316745,"locate1d_local_ns":3.482506,"eval2d_ebl_ns":4.428482,"max_cv_pct":4.12727},"status":"discard","description":"Split cold binary search into upward and downward three-argument helpers; the aggregate moved only within noise and direct search cases did not consistently improve.","timestamp":1789420436486,"segment":0,"confidence":11.193807347834024,"asi":{"hypothesis":"Directional cold search helpers will remove one bound argument and specialize a constant bound for distant queries.","rollback_reason":"The apparent 0.08% primary gain is below noise; locate1d random worsened slightly and array workloads regressed, while duplicated helper code increased complexity.","next_action_hint":"Keep the single four-argument _bsearch_range helper. Call ABI bound specialization is not a useful bottleneck."}}
{"run":71,"commit":"843e892","metric":7.175233,"metrics":{"one_d_ns":6.104755,"two_d_ns":8.43342,"scalar_ns":7.623607,"array_ns":5.299237,"locate1d_local_ns":3.464455,"eval2d_ebl_ns":4.34371,"max_cv_pct":4.146802},"status":"keep","description":"Cached lower and upper row views in the generic 2D scalar evaluator; arbitrary-strided repeated-field evaluation improves about 4%.","timestamp":1789420507468,"segment":0,"confidence":11.188769538422587,"asi":{"hypothesis":"Caching two row views will reuse dimension-0 base address calculations across adjacent dimension-1 corner loads for arbitrary-strided values.","strided_eval_gain_pct":4.02,"primary_gain_pct":0.31,"learning":"For arbitrary-strided 2D arrays, row-view base caching is better than four independent multidimensional addresses; C-layout still uses its flat-offset specialization."}}
{"run":72,"commit":"1dfbbb8","metric":7.156635,"metrics":{"one_d_ns":6.092753,"two_d_ns":8.406286,"scalar_ns":7.611476,"array_ns":5.259068,"locate1d_local_ns":3.45496,"eval2d_ebl_ns":4.358232,"max_cv_pct":4.953158},"status":"keep","description":"Applied row-view base caching to the extrapolating 2D array loop; array interpolation and the primary metric improve modestly.","timestamp":1789420565498,"segment":0,"confidence":11.197430239698589,"asi":{"hypothesis":"The row-view address reuse that improved arbitrary-strided scalar evaluation will also reduce repeated dimension-0 address setup in the versioned 2D array loop.","array_2d_gain_pct":1.29,"primary_gain_pct":0.26,"learning":"Row base reuse transfers to array interpolation and remains useful alongside compile-time C-layout optimization, with a smaller gain than eval-only."}}
{"run":73,"commit":"1dfbbb8","metric":7.177028,"metrics":{"one_d_ns":6.117834,"two_d_ns":8.419602,"scalar_ns":7.588046,"array_ns":5.432728,"locate1d_local_ns":3.460792,"eval2d_ebl_ns":4.347037,"max_cv_pct":4.221241},"status":"discard","description":"Forced the cold range-only binary helper inline after the early-return rewrite; random 1D improved, but code expansion hurt arrays and random 2D.","timestamp":1789420653518,"segment":0,"confidence":10.10600124841072,"asi":{"hypothesis":"The smaller range-only helper and branch-local locate structure may now make binary-loop inlining profitable for distant searches.","revisits_run":17,"changed_assumption":"The inlined helper no longer contains same/adjacent checks, and the caller now uses early returns without SSA merges.","rollback_reason":"Primary regressed 0.29%; array1d worsened 6.8% and random2d 1.8%, despite locate1d random improving 3.1%. Compilation also expanded materially.","next_action_hint":"Keep the binary range loop out of line. Its call cost is preferable to duplicated code in array and 2D callers."}}
{"run":74,"commit":"1dfbbb8","metric":7.152646,"metrics":{"one_d_ns":6.091857,"two_d_ns":8.398153,"scalar_ns":7.599,"array_ns":5.284675,"locate1d_local_ns":3.465653,"eval2d_ebl_ns":4.344521,"max_cv_pct":4.140945},"status":"discard","description":"Used an explicit right shift for binary-search midpoints; LLVM already optimizes nonnegative floor division and the apparent aggregate change was noise.","timestamp":1789420710575,"segment":0,"confidence":9.208441715732972,"asi":{"hypothesis":"Because search bounds are nonnegative, an explicit right shift may generate a shorter midpoint calculation than floor division by two.","rollback_reason":"Primary improved only 0.056%, below noise; directly affected random locate changed by just 0.01 ns and arrays worsened.","next_action_hint":"Keep // 2 for clarity; LLVM already strength-reduces it."}}
{"run":75,"commit":"1dfbbb8","metric":7.153897,"metrics":{"one_d_ns":6.043891,"two_d_ns":8.467764,"scalar_ns":7.611169,"array_ns":5.248064,"locate1d_local_ns":3.461567,"eval2d_ebl_ns":4.338334,"max_cv_pct":4.155736},"status":"discard","description":"Changed the cold binary loop condition to an interval-width subtraction; 1D random improved, but 2D combined paths regressed and the primary gain was below noise.","timestamp":1789420762169,"segment":0,"confidence":9.0598210921003,"asi":{"hypothesis":"Comparing the binary interval width to one may shorten loop control and aid distant searches.","rollback_reason":"The 0.038% primary gain is noise; interp2d local/random worsened about 2.3% while locate1d random improved 2.3%, so the change is not broadly beneficial.","next_action_hint":"Keep the existing upper-versus-lower-plus-one condition."}}
{"run":76,"commit":"1dfbbb8","metric":7.214437,"metrics":{"one_d_ns":6.181863,"two_d_ns":8.419484,"scalar_ns":7.612648,"array_ns":5.514879,"locate1d_local_ns":3.46401,"eval2d_ebl_ns":4.338595,"max_cv_pct":4.556875},"status":"discard","description":"Retried dimension-1-first search only in the versioned extrapolating 2D array loop; the prior direct gain disappeared after row-view caching.","timestamp":1789420845124,"segment":0,"confidence":8.91592162751688,"asi":{"hypothesis":"After loop versioning and row-base caching, dimension-1-first search may finally improve both array2d and the balanced primary.","revisits_run":62,"changed_assumption":"Only the extrapolating loop is reordered, and its value addressing now uses cached row views.","rollback_reason":"Primary regressed 0.81% and array2d itself worsened from 7.49 to 7.62 ns; the changed loop structure invalidated the earlier isolated gain.","next_action_hint":"Keep dimension 0 first in both 2D array branches."}}
{"run":77,"commit":"1dfbbb8","metric":7.174392,"metrics":{"one_d_ns":6.129311,"two_d_ns":8.397666,"scalar_ns":7.6265,"array_ns":5.28548,"locate1d_local_ns":3.527158,"eval2d_ebl_ns":4.369215,"max_cv_pct":3.938669},"status":"discard","description":"Loaded generic 2D scalar indices before weights to expose fp address dependencies earlier; the strided signal was small and the primary regressed.","timestamp":1789420920027,"segment":0,"confidence":8.764042298577914,"asi":{"hypothesis":"Loading indices before weights will start dependent row-address calculation earlier in repeated 2D evaluation.","rollback_reason":"Primary regressed 0.25%; strided eval moved only about 1.1% and unchanged workloads dominated the opposite direction.","next_action_hint":"Keep weights first so non-extrapolating rejection can avoid index/address work and source order remains semantically efficient."}}
{"run":78,"commit":"1dfbbb8","metric":7.198558,"metrics":{"one_d_ns":6.09793,"two_d_ns":8.497841,"scalar_ns":7.657855,"array_ns":5.283691,"locate1d_local_ns":3.468386,"eval2d_ebl_ns":4.476309,"max_cv_pct":4.173115},"status":"discard","description":"Removed the explicit shared dimension-0 complement from generic 2D evaluation; strided repeated-field evaluation regressed materially.","timestamp":1789420966026,"segment":0,"confidence":8.617250714875011,"asi":{"hypothesis":"With cached row views, spelling 1-weight0 twice may let LLVM schedule arithmetic without an explicit live complement local.","rollback_reason":"Primary regressed 0.59% and strided eval rose from about 5.69 to 5.89 ns; explicit complement reuse is important in this tiny evaluator.","next_action_hint":"Preserve upper_weight0 in scalar 2D evaluation and document it as intentional."}}
{"run":79,"commit":"1dfbbb8","metric":7.154468,"metrics":{"one_d_ns":6.086948,"two_d_ns":8.409208,"scalar_ns":7.611292,"array_ns":5.250155,"locate1d_local_ns":3.449228,"eval2d_ebl_ns":4.350127,"max_cv_pct":4.535571},"status":"discard","description":"Inlined only C-eval index/weight extraction and called a non-inline scalar-components helper; call ABI changes did not improve C evaluation.","timestamp":1789421071939,"segment":0,"confidence":8.443198963433321,"asi":{"hypothesis":"A tiny inline wrapper can scalarize index/weight views while keeping C bilinear arithmetic out of line, avoiding run 50's code-pressure failure.","changed_assumption":"Unlike run 50, only four component loads are inlined; flat corner loads and arithmetic remain in a compact callee.","rollback_reason":"The 0.03% primary movement is noise and C eval regressed from about 3.34 to 3.40 ns; passing six scalar/array arguments is no cheaper than passing two row views.","next_action_hint":"Keep the compact out-of-line C eval overload with its internal always-inline flat helper."}}
{"run":80,"commit":"1dfbbb8","metric":7.181788,"metrics":{"one_d_ns":6.073519,"two_d_ns":8.492288,"scalar_ns":7.644758,"array_ns":5.255047,"locate1d_local_ns":3.456781,"eval2d_ebl_ns":4.349137,"max_cv_pct":4.584694},"status":"discard","description":"Named C-eval index components before flat offset calculation; extra source locals did not aid addressing and the aggregate regressed.","timestamp":1789421119231,"segment":0,"confidence":8.276039026326545,"asi":{"hypothesis":"Explicit index0/index1 locals may expose scalar view loads and shorten C flat-offset address calculation.","rollback_reason":"Primary regressed 0.35% and C eval stayed around 3.40 ns; each component is used once and LLVM already loads it optimally.","next_action_hint":"Keep the compact offset expression."}}
